all/DT readable/JJ tetraploid/NN of/IN shell/NN are/VBP deranged/JJ reaction/NN <UNK>/NN that/WDT do/VBP not/RB rob/VB any/DT liver/NN of/IN threaded/JJ meter/NN ./. <EOS>/<EOS>	LOC#1 LOC#2 LOC#3 LOC#4 := LOC#6 LOC#7 LOC#8 ^ ! E LOC#12 . ( LOC#14 LOC#15 LOC#16 LOC#17 ) <EOS>
all/DT butt/NN of/IN dead/JJ match/NN are/VBP successful/JJ alternative/NN reliability/NN that/WDT cheat/VB no/DT strict/JJ or/CC residential/JJ sauce/NN ./. <EOS>/<EOS>	LOC#1 LOC#2 LOC#3 LOC#4 := LOC#6 LOC#7 LOC#8 ^ ! E LOC#10 . ( LOC#12 LOC#15 U LOC#14 LOC#15 ) <EOS>
a/DT <UNK>/NN of/IN soul/NN concert/NN is/VBZ also/RB a/DT copy/NN detail/NN of/IN surprise/NN or/CC a/DT awful/JJ fascinating/JJ <UNK>/NN ./. <EOS>/<EOS>	LOC#1 LOC#2 LOC#3 LOC#4 := LOC#8 LOC#9 LOC#10 LOC#11 U LOC#14 LOC#15 LOC#16 <EOS>
all/DT the/DT <UNK>/NN <UNK>/NN are/VBP also/RB waggish/JJ apartment/NN of/IN gasoline/NN that/WDT sneak/VB <UNK>/JJ or/CC innovative/JJ operating/NN ./. <EOS>/<EOS>	LOC#2 LOC#3 := LOC#6 LOC#7 LOC#8 LOC#9 ^ E LOC#11 . ( LOC#12 LOC#15 U LOC#14 LOC#15 ) <EOS>
defense/NN of/IN folk/NN concentration/NN conceive/VB or/CC analyse/VB plus/JJ identity/NN confusion/NN or/CC futuristic/JJ drug/NN ./. <EOS>/<EOS>	LOC#0 LOC#1 LOC#2 LOC#3 := E ( LOC#4 U LOC#6 ) . ( LOC#7 LOC#8 LOC#9 U LOC#11 LOC#12 ) <EOS>
<UNK>/NN of/IN framework/NN are/VBP ragu/NN of/IN <UNK>/JJ servant/NN or/CC <UNK>/JJ feigned/JJ media/NN ./. <EOS>/<EOS>	LOC#0 LOC#1 LOC#2 := LOC#4 LOC#5 LOC#6 LOC#7 U LOC#9 LOC#10 LOC#11 <EOS>
all/DT the/DT funding/NN of/IN mom/NN rush/NN wriggle/VB or/CC untidy/VB spotted/JJ drawing/NN and/CC horrible/JJ raster/NN circumstance/NN ./. <EOS>/<EOS>	LOC#2 LOC#3 LOC#4 LOC#5 := E ( LOC#6 U LOC#8 ) . ( LOC#9 LOC#10 ) ^ E ( LOC#6 U LOC#8 ) . ( LOC#12 LOC#13 LOC#14 ) <EOS>
shortage/NN of/IN PC/NN are/VBP scent/NN of/IN benefit/NN cop/NN that/WDT announce/VB new/JJ refuge/NN <UNK>/NN ,/. perceived/JJ cartilage/NN mouth/NN and/CC mere/JJ pine/NN development/NN ./. <EOS>/<EOS>	LOC#0 LOC#1 LOC#2 := LOC#4 LOC#5 LOC#6 LOC#7 ^ E LOC#9 . ( LOC#10 LOC#11 LOC#12 ) ^ E LOC#9 . ( LOC#14 LOC#15 LOC#16 ) ^ E LOC#9 . ( LOC#18 LOC#19 LOC#20 ) <EOS>
odontogenic/JJ helper/NN are/VBP also/RB selective/JJ observer/NN of/IN pastor/NN and/CC cultural/JJ cliff/NN regulation/NN ./. <EOS>/<EOS>	LOC#0 LOC#1 := LOC#4 LOC#5 LOC#6 LOC#7 ^ LOC#9 LOC#10 LOC#11 <EOS>
measure/NN of/IN station/NN are/VBP brown/JJ godly/JJ terrain/NN or/CC deafening/JJ <UNK>/NN of/IN cabin/NN ./. <EOS>/<EOS>	LOC#0 LOC#1 LOC#2 := LOC#4 LOC#5 LOC#6 U LOC#8 LOC#9 LOC#10 LOC#11 <EOS>
all/DT the/DT previous/JJ fact/NN of/IN electricity/NN deserve/VB or/CC soar/VB no/DT beef/NN of/IN industrious/JJ dassie/NN or/CC of/IN erratic/JJ belief/NN ./. <EOS>/<EOS>	LOC#2 LOC#3 LOC#4 LOC#5 := ! E ( LOC#6 ^ LOC#8 ) . ( LOC#10 LOC#11 LOC#12 LOC#13 U LOC#10 LOC#15 LOC#16 LOC#17 ) <EOS>
all/DT the/DT handy/JJ closed/JJ sibling/NN are/VBP specific/JJ painting/NN of/IN encoder/NN or/CC shark/NN of/IN merciful/JJ garlic/NN ./. <EOS>/<EOS>	LOC#2 LOC#3 LOC#4 := LOC#6 LOC#7 LOC#8 LOC#9 U LOC#11 LOC#12 LOC#13 LOC#14 <EOS>
all/DT the/DT ownership/NN <UNK>/VB only/RB hero/NN ,/. release/NN and/CC faculty/NN ./. <EOS>/<EOS>	LOC#2 := A LOC#3 . ( LOC#5 ) ^ A LOC#3 . ( LOC#7 ) ^ A LOC#3 . ( LOC#9 ) <EOS>
all/DT bomb/NN of/IN assessment/NN water/NN are/VBP permissible/JJ confidence/NN Christianity/NN or/CC labor/NN ./. <EOS>/<EOS>	LOC#1 LOC#2 LOC#3 LOC#4 := LOC#6 LOC#7 LOC#8 U LOC#10 <EOS>
unusual/JJ roll/NN of/IN composition/NN are/VBP gaze/NN of/IN <UNK>/NN that/WDT are/VBP kaput/JJ ./. <EOS>/<EOS>	LOC#0 LOC#1 LOC#2 LOC#3 := LOC#5 LOC#6 LOC#7 ^ LOC#10 <EOS>
every/DT goat/NN of/IN inherent/JJ barrel/NN shine/VB at/IN least/JJS NUM/CD and/CC less/JJR than/IN NUM/CD year/NN of/IN lamb/NN or/CC of/IN useless/JJ <UNK>/NN ./. <EOS>/<EOS>	LOC#1 LOC#2 LOC#3 LOC#4 := ( >= LOC#8 && < LOC#12 ) LOC#5 . ( LOC#13 LOC#14 LOC#15 U LOC#13 LOC#17 LOC#18 LOC#19 ) <EOS>
a/DT lonely/JJ nasty/JJ transport/NN implement/VB at/IN most/JJS NUM/CD true/JJ fashion/NN of/IN consumer/NN and/CC of/IN script/NN ./. <EOS>/<EOS>	LOC#1 LOC#2 LOC#3 := <= LOC#7 LOC#4 . ( LOC#8 LOC#9 LOC#10 LOC#11 ^ LOC#8 LOC#9 LOC#13 LOC#14 ) <EOS>
every/DT war/NN of/IN bottle/NN is/VBZ a/DT victim/NN of/IN chain/NN or/CC a/DT chubby/JJ chillus/NN <UNK>/NN ./. <EOS>/<EOS>	LOC#1 LOC#2 LOC#3 := LOC#6 LOC#7 LOC#8 U LOC#11 LOC#12 LOC#13 <EOS>
all/DT similarity/NN of/IN pumped/JJ tennis/NN are/VBP pool/NN that/WDT depend/VB or/CC burn/VB no/DT imported/JJ truth/NN of/IN shot/NN and/CC of/IN productive/JJ <UNK>/NN ./. <EOS>/<EOS>	LOC#1 LOC#2 LOC#3 LOC#4 := LOC#6 ^ ! E ( LOC#8 ^ LOC#10 ) . ( LOC#12 LOC#13 LOC#14 LOC#15 ^ LOC#12 LOC#13 LOC#17 LOC#18 LOC#19 ) <EOS>
every/DT willingness/NN quote/NN of/IN conduct/NN persist/VB not/RB less/JJR than/IN NUM/CD dominant/JJ and/CC missing/JJ aid/NN ./. <EOS>/<EOS>	LOC#1 LOC#2 LOC#3 LOC#4 := >= LOC#9 LOC#5 . ( LOC#10 LOC#13 ^ LOC#12 LOC#13 ) <EOS>
a/DT danger/NN achievement/NN of/IN cream/NN shout/VB no/DT more/JJR than/IN NUM/CD or/CC more/JJR than/IN NUM/CD hateful/JJ colleague/NN hypothesis/NN ,/. raw/JJ collar/NN detective/NN ,/. or/CC works/NN rhetoric/NN ./. <EOS>/<EOS>	LOC#1 LOC#2 LOC#3 LOC#4 := ( <= LOC#9 || > LOC#13 ) LOC#5 . ( LOC#14 LOC#15 LOC#16 U LOC#18 LOC#19 LOC#20 U LOC#23 LOC#24 ) <EOS>
a/DT skillful/JJ feta/NN is/VBZ something/NN that/WDT provide/VB also/RB biosphere/NN and/CC pleasant/JJ dress/NN lesson/NN ./. <EOS>/<EOS>	LOC#1 LOC#2 := E LOC#6 . ( LOC#8 ) ^ E LOC#6 . ( LOC#10 LOC#11 LOC#12 ) <EOS>
every/DT tent/NN of/IN rampant/JJ testing/NN is/VBZ also/RB a/DT wet/JJ airport/NN odontoblast/NN that/WDT stitch/VB no/DT <UNK>/NN of/IN reality/NN and/CC of/IN disastrous/JJ <UNK>/NN ./. <EOS>/<EOS>	LOC#1 LOC#2 LOC#3 LOC#4 := LOC#8 LOC#9 LOC#10 ^ ! E LOC#12 . ( LOC#14 LOC#15 LOC#16 ^ LOC#14 LOC#18 LOC#19 LOC#20 ) <EOS>
all/DT the/DT full/JJ integrity/NN do/VBP not/RB settle/VB any/DT uppity/JJ climate/NN veteran/NN or/CC heat/NN obstacle/NN ./. <EOS>/<EOS>	LOC#2 LOC#3 := ! E LOC#6 . ( LOC#8 LOC#9 LOC#10 U LOC#12 LOC#13 ) <EOS>
exercise/NN start/NN are/VBP also/RB numberless/JJ basketball/NN that/WDT are/VBP non-mineralized/JJ ./. <EOS>/<EOS>	LOC#0 LOC#1 := LOC#4 LOC#5 ^ LOC#8 <EOS>
all/DT the/DT site/NN think/VB or/CC dismiss/VB only/RB travel/NN of/IN snow/NN and/CC of/IN glove/NN ./. <EOS>/<EOS>	LOC#2 := A ( LOC#3 U LOC#5 ) . ( LOC#7 LOC#8 LOC#9 ^ LOC#7 LOC#11 LOC#12 ) <EOS>
all/DT the/DT policy/NN of/IN goods/NN disagree/VB only/RB deadly/JJ <UNK>/NN ,/. flour/NN and/CC ecosystem/NN bush/NN ./. <EOS>/<EOS>	LOC#2 LOC#3 LOC#4 := A LOC#5 . ( LOC#7 LOC#8 ) ^ A LOC#5 . ( LOC#10 ) ^ A LOC#5 . ( LOC#12 LOC#13 ) <EOS>
every/DT database/NN seafood/NN is/VBZ also/RB a/DT hoc/JJ pointless/JJ <UNK>/NN that/WDT is/VBZ nutty/JJ ./. <EOS>/<EOS>	LOC#1 LOC#2 := LOC#6 LOC#7 LOC#8 ^ LOC#11 <EOS>
kindhearted/JJ slide/NN of/IN cargo/NN are/VBP also/RB sacred/JJ magnitude/NN that/WDT are/VBP hearing/NN of/IN experimental/JJ information/NN ./. <EOS>/<EOS>	LOC#0 LOC#1 LOC#2 LOC#3 := LOC#6 LOC#7 ^ LOC#10 LOC#11 LOC#12 LOC#13 <EOS>
<UNK>/NN do/VBP not/RB describe/VB any/DT used/JJ <UNK>/NN ./. <EOS>/<EOS>	LOC#0 := ! E LOC#3 . ( LOC#5 LOC#6 ) <EOS>
every/DT aboriginal/JJ top/NN of/IN mother/NN is/VBZ also/RB a/DT touchdown/NN of/IN initial/JJ lover/NN that/WDT <UNK>/VB no/DT melodic/JJ and/CC grey/JJ <UNK>/NN ./. <EOS>/<EOS>	LOC#1 LOC#2 LOC#3 LOC#4 := LOC#8 LOC#9 LOC#10 LOC#11 ^ ! E LOC#13 . ( LOC#15 LOC#18 ^ LOC#17 LOC#18 ) <EOS>
wage/NN of/IN physician/NN criminal/NN are/VBP wheat/NN factory/NN of/IN tabasco/NN that/WDT bang/VB or/CC long/VB vertical/JJ experiment/NN buyer/NN or/CC density/NN broadcast/NN ./. <EOS>/<EOS>	LOC#0 LOC#1 LOC#2 LOC#3 := LOC#5 LOC#6 LOC#7 LOC#8 ^ E ( LOC#10 U LOC#12 ) . ( LOC#13 LOC#14 LOC#15 U LOC#17 LOC#18 ) <EOS>
damaging/JJ quaint/JJ recipient/NN stamp/VB and/CC admire/VB ambitious/JJ horse/NN of/IN island/NN ./. <EOS>/<EOS>	LOC#0 LOC#1 LOC#2 := E ( LOC#3 ^ LOC#5 ) . ( LOC#6 LOC#7 LOC#8 LOC#9 ) <EOS>
<UNK>/NN grant/NN of/IN historian/NN are/VBP also/RB anything/NN that/WDT expand/VB or/CC survive/VB only/RB writer/NN toilet/NN and/CC furtive/JJ <UNK>/NN priest/NN ./. <EOS>/<EOS>	LOC#0 LOC#1 LOC#2 LOC#3 := A ( LOC#8 U LOC#10 ) . ( LOC#12 LOC#13 ) ^ A ( LOC#8 U LOC#10 ) . ( LOC#15 LOC#16 LOC#17 ) <EOS>
every/DT lifestyle/NN frame/NN of/IN participation/NN do/VBP not/RB ensure/VB any/DT attempt/NN of/IN single/JJ protection/NN ./. <EOS>/<EOS>	LOC#1 LOC#2 LOC#3 LOC#4 := ! E LOC#7 . ( LOC#9 LOC#10 LOC#11 LOC#12 ) <EOS>
<UNK>/JJ <UNK>/NN doubt/NN are/VBP also/RB coin/NN shift/NN of/IN impulse/NN and/CC wide-eyed/JJ debate/NN ./. <EOS>/<EOS>	LOC#0 LOC#1 LOC#2 := LOC#5 LOC#6 LOC#7 LOC#8 ^ LOC#10 LOC#11 <EOS>
every/DT quarterback/NN of/IN orientation/NN beach/NN is/VBZ also/RB something/NN that/WDT participate/VB only/RB testimony/NN and/CC sloppy/JJ importance/NN ./. <EOS>/<EOS>	LOC#1 LOC#2 LOC#3 LOC#4 := A LOC#9 . ( LOC#11 ) ^ A LOC#9 . ( LOC#13 LOC#14 ) <EOS>
a/DT exchange/NN of/IN cycle/NN <UNK>/NN is/VBZ something/NN that/WDT drain/VB quick/JJ tour/NN and/CC spectacular/JJ poetry/NN ./. <EOS>/<EOS>	LOC#1 LOC#2 LOC#3 LOC#4 := E LOC#8 . ( LOC#9 LOC#10 ) ^ E LOC#8 . ( LOC#12 LOC#13 ) <EOS>
all/DT speculation/NN of/IN fly/NN neighbor/NN weaken/VB and/CC open/VB fantastic/JJ pepperoni/NN figure/NN or/CC papilla/NN ./. <EOS>/<EOS>	LOC#1 LOC#2 LOC#3 LOC#4 := E ( LOC#5 ^ LOC#7 ) . ( LOC#8 LOC#9 LOC#10 U LOC#12 ) <EOS>
deadpan/JJ glossy/JJ <UNK>/NN articulate/VB only/RB groovy/JJ symptomatic/JJ husband/NN ./. <EOS>/<EOS>	LOC#0 LOC#1 LOC#2 := A LOC#3 . ( LOC#5 LOC#6 LOC#7 ) <EOS>
every/DT researcher/NN of/IN encouraging/JJ integer/NN register/VB more/JJR than/IN NUM/CD but/CC less/JJR than/IN NUM/CD disturbing/JJ tray/NN or/CC throat/NN ./. <EOS>/<EOS>	LOC#1 LOC#2 LOC#3 LOC#4 := ( > LOC#8 && < LOC#12 ) LOC#5 . ( LOC#13 LOC#14 U LOC#16 ) <EOS>
swing/NN of/IN cat/NN exceed/VB no/DT judicious/JJ and/CC profound/JJ laundry/NN ./. <EOS>/<EOS>	LOC#0 LOC#1 LOC#2 := ! E LOC#3 . ( LOC#5 LOC#8 ^ LOC#7 LOC#8 ) <EOS>
a/DT biological/JJ business/NN of/IN art/NN is/VBZ also/RB something/NN that/WDT itch/VB no/DT journalism/NN of/IN traveler/NN and/CC of/IN old/JJ English/NN ./. <EOS>/<EOS>	LOC#1 LOC#2 LOC#3 LOC#4 := ! E LOC#9 . ( LOC#11 LOC#12 LOC#13 ^ LOC#11 LOC#15 LOC#16 LOC#17 ) <EOS>
all/DT the/DT rolling/JJ synonymous/JJ democracy/NN disseminate/VB no/DT project/NN of/IN fruit/NN or/CC of/IN nappy/JJ belt/NN ./. <EOS>/<EOS>	LOC#2 LOC#3 LOC#4 := ! E LOC#5 . ( LOC#7 LOC#8 LOC#9 U LOC#7 LOC#11 LOC#12 LOC#13 ) <EOS>
all/DT the/DT permanent/JJ <UNK>/JJ compound/NN appear/VB more/JJR than/IN NUM/CD metaphor/NN of/IN cranium/NN or/CC of/IN deposit/NN ./. <EOS>/<EOS>	LOC#2 LOC#3 LOC#4 := > LOC#8 LOC#5 . ( LOC#9 LOC#10 LOC#11 U LOC#9 LOC#13 LOC#14 ) <EOS>
every/DT group/NN interpreter/NN of/IN jet/NN is/VBZ a/DT cache/NN of/IN developmental/JJ interpretation/NN that/WDT lend/VB and/CC <UNK>/VB also/RB caudal/JJ ,/. bumpy/JJ or/CC wholesale/JJ banking/NN ./. <EOS>/<EOS>	LOC#1 LOC#2 LOC#3 LOC#4 := LOC#7 LOC#8 LOC#9 LOC#10 ^ E ( LOC#12 ^ LOC#14 ) . ( LOC#16 LOC#21 U LOC#18 LOC#21 U LOC#20 LOC#21 ) <EOS>
bias/NN analysis/NN of/IN pasta/NN are/VBP maddening/JJ conception/NN that/WDT are/VBP request/NN container/NN of/IN commissioner/NN ./. <EOS>/<EOS>	LOC#0 LOC#1 LOC#2 LOC#3 := LOC#5 LOC#6 ^ LOC#9 LOC#10 LOC#11 LOC#12 <EOS>
sweater/NN of/IN sanction/NN fund/NN do/VBP not/RB wrap/VB any/DT impossible/JJ <UNK>/NN or/CC historic/JJ CEO/NN whale/NN ./. <EOS>/<EOS>	LOC#0 LOC#1 LOC#2 LOC#3 := ! E LOC#6 . ( LOC#8 LOC#9 U LOC#11 LOC#12 LOC#13 ) <EOS>
all/DT the/DT lab/NN do/VBP not/RB constitute/VB point/NN of/IN election/NN and/CC of/IN highfalutin/JJ venture/NN ./. <EOS>/<EOS>	LOC#2 := ! E LOC#5 . ( LOC#6 LOC#7 LOC#8 ^ LOC#6 LOC#10 LOC#11 LOC#12 ) <EOS>
all/DT <UNK>/NN of/IN hapless/JJ <UNK>/NN <UNK>/VB and/CC propose/VB humorous/JJ <UNK>/NN liability/NN ,/. lens/NN premise/NN ,/. and/CC such/JJ technician/NN ./. <EOS>/<EOS>	LOC#1 LOC#2 LOC#3 LOC#4 := E ( LOC#5 ^ LOC#7 ) . ( LOC#8 LOC#9 LOC#10 ) ^ E ( LOC#5 ^ LOC#7 ) . ( LOC#12 LOC#13 ) ^ E ( LOC#5 ^ LOC#7 ) . ( LOC#16 LOC#17 ) <EOS>
all/DT the/DT essence/NN cough/VB or/CC earn/VB loop/NN and/CC initializer/NN ./. <EOS>/<EOS>	LOC#2 := E ( LOC#3 U LOC#5 ) . ( LOC#6 ) ^ E ( LOC#3 U LOC#5 ) . ( LOC#8 ) <EOS>
every/DT multiple/JJ custody/NN exhaust/VB no/DT rough/JJ sensation/NN or/CC powder/NN ./. <EOS>/<EOS>	LOC#1 LOC#2 := ! E LOC#3 . ( LOC#5 LOC#6 U LOC#8 ) <EOS>
all/DT verbal/JJ due/JJ <UNK>/NN do/VBP not/RB tick/VB nor/DT born/VB any/DT consent/NN Christmas/NN ./. <EOS>/<EOS>	LOC#1 LOC#2 LOC#3 := ! E ( LOC#6 ^ LOC#8 ) . ( LOC#10 LOC#11 ) <EOS>
all/DT jazzy/JJ chin/NN are/VBP also/RB signature/NN rice/NN of/IN chunk/NN or/CC railroad/NN of/IN <UNK>/NN ./. <EOS>/<EOS>	LOC#1 LOC#2 := LOC#5 LOC#6 LOC#7 LOC#8 U LOC#10 LOC#11 LOC#12 <EOS>
promotion/NN of/IN revolution/NN are/VBP neck/NN of/IN resonant/JJ tragedy/NN that/WDT are/VBP classic/JJ ./. <EOS>/<EOS>	LOC#0 LOC#1 LOC#2 := LOC#4 LOC#5 LOC#6 LOC#7 ^ LOC#10 <EOS>
violent/JJ legislation/NN of/IN sample/NN are/VBP also/RB food/NN sector/NN of/IN peer/NN or/CC difficult/JJ mighty/JJ <UNK>/NN ./. <EOS>/<EOS>	LOC#0 LOC#1 LOC#2 LOC#3 := LOC#6 LOC#7 LOC#8 LOC#9 U LOC#11 LOC#12 LOC#13 <EOS>
dot/NN are/VBP also/RB listener/NN of/IN <UNK>/NN debut/NN and/CC costume/NN hole/NN of/IN possession/NN ./. <EOS>/<EOS>	LOC#0 := LOC#3 LOC#4 LOC#5 LOC#6 ^ LOC#8 LOC#9 LOC#10 LOC#11 <EOS>
all/DT <UNK>/NN are/VBP also/RB instinctive/JJ jaw/NN leather/NN and/CC impartial/JJ elaborate/JJ anxiety/NN ./. <EOS>/<EOS>	LOC#1 := LOC#4 LOC#5 LOC#6 ^ LOC#8 LOC#9 LOC#10 <EOS>
all/DT american/JJ crispy/JJ privilege/NN are/VBP intervention/NN of/IN apple/NN or/CC interior/NN of/IN assistance/NN winter/NN ./. <EOS>/<EOS>	LOC#1 LOC#2 LOC#3 := LOC#5 LOC#6 LOC#7 U LOC#9 LOC#10 LOC#11 LOC#12 <EOS>
paired/JJ over/JJ ease/NN observe/VB and/CC create/VB working/JJ ,/. devilish/JJ ,/. and/CC obedient/JJ viewer/NN ./. <EOS>/<EOS>	LOC#0 LOC#1 LOC#2 := E ( LOC#3 ^ LOC#5 ) . ( LOC#6 LOC#12 ^ LOC#8 LOC#12 ^ LOC#11 LOC#12 ) <EOS>
malicious/JJ <UNK>/NN are/VBP also/RB <UNK>/NN of/IN puzzle/NN and/CC flowery/JJ honest/JJ trading/NN ./. <EOS>/<EOS>	LOC#0 LOC#1 := LOC#4 LOC#5 LOC#6 ^ LOC#8 LOC#9 LOC#10 <EOS>
disgusted/JJ <UNK>/NN are/VBP quarter/NN of/IN nifty/JJ helicopter/NN and/CC fine/JJ activity/NN ./. <EOS>/<EOS>	LOC#0 LOC#1 := LOC#3 LOC#4 LOC#5 LOC#6 ^ LOC#8 LOC#9 <EOS>
all/DT quantity/NN of/IN darkness/NN wedding/NN tabulate/VB NUM/CD huge/JJ or/CC tearful/JJ effectiveness/NN ./. <EOS>/<EOS>	LOC#1 LOC#2 LOC#3 LOC#4 := = LOC#6 LOC#5 . ( LOC#7 LOC#10 U LOC#9 LOC#10 ) <EOS>
merit/NN of/IN fleet/NN are/VBP also/RB auspicious/JJ representation/NN that/WDT clarify/VB and/CC categorize/VB only/RB rabid/JJ or/CC slight/JJ frutti/NN ./. <EOS>/<EOS>	LOC#0 LOC#1 LOC#2 := LOC#5 LOC#6 ^ A ( LOC#8 ^ LOC#10 ) . ( LOC#12 LOC#15 U LOC#14 LOC#15 ) <EOS>
every/DT fair/JJ frightening/JJ mesenchyme/NN is/VBZ a/DT light/NN policeman/NN of/IN <UNK>/NN that/WDT is/VBZ overwhelming/JJ ./. <EOS>/<EOS>	LOC#1 LOC#2 LOC#3 := LOC#6 LOC#7 LOC#8 LOC#9 ^ LOC#12 <EOS>
all/DT glance/NN are/VBP distinct/JJ fanatical/JJ lock/NN that/WDT scrape/VB and/CC meet/VB also/RB mental/JJ emphasis/NN ,/. eastern/JJ seller/NN ,/. or/CC mystery/NN ./. <EOS>/<EOS>	LOC#1 := LOC#3 LOC#4 LOC#5 ^ E ( LOC#7 ^ LOC#9 ) . ( LOC#11 LOC#12 U LOC#14 LOC#15 U LOC#18 ) <EOS>
remark/NN compliance/NN are/VBP anything/NN that/WDT suffer/VB or/CC mutter/VB only/RB ratio/NN ,/. impression/NN ,/. and/CC college/NN slice/NN ./. <EOS>/<EOS>	LOC#0 LOC#1 := A ( LOC#5 U LOC#7 ) . ( LOC#9 ) ^ A ( LOC#5 U LOC#7 ) . ( LOC#11 ) ^ A ( LOC#5 U LOC#7 ) . ( LOC#14 LOC#15 ) <EOS>
every/DT lip/NN place/NN is/VBZ also/RB a/DT popularity/NN of/IN monitor/NN wonder/NN that/WDT is/VBZ administrative/JJ ./. <EOS>/<EOS>	LOC#1 LOC#2 := LOC#6 LOC#7 LOC#8 LOC#9 ^ LOC#12 <EOS>
all/DT external/JJ margherita/NN of/IN administration/NN engage/VB also/RB pile/NN of/IN constraint/NN or/CC of/IN alluring/JJ sales/NN ./. <EOS>/<EOS>	LOC#1 LOC#2 LOC#3 LOC#4 := E LOC#5 . ( LOC#7 LOC#8 LOC#9 U LOC#7 LOC#11 LOC#12 LOC#13 ) <EOS>
all/DT the/DT hurricane/NN stir/VB more/JJR than/IN NUM/CD and/CC less/JJR than/IN NUM/CD pickup/NN of/IN wealth/NN or/CC of/IN curtain/NN ./. <EOS>/<EOS>	LOC#2 := ( > LOC#6 && < LOC#10 ) LOC#3 . ( LOC#11 LOC#12 LOC#13 U LOC#11 LOC#15 LOC#16 ) <EOS>
a/DT chronic/JJ soil/NN floor/NN convict/VB or/CC collate/VB also/RB cut/NN unity/NN ,/. auction/NN juice/NN and/CC pre-existing/JJ flag/NN kiss/NN ./. <EOS>/<EOS>	LOC#1 LOC#2 LOC#3 := E ( LOC#4 U LOC#6 ) . ( LOC#8 LOC#9 ) ^ E ( LOC#4 U LOC#6 ) . ( LOC#11 LOC#12 ) ^ E ( LOC#4 U LOC#6 ) . ( LOC#14 LOC#15 LOC#16 ) <EOS>
every/DT cluster/NN of/IN general/NN slap/VB or/CC strengthen/VB defeat/NN troop/NN and/CC another/JJ flow/NN ./. <EOS>/<EOS>	LOC#1 LOC#2 LOC#3 := E ( LOC#4 U LOC#6 ) . ( LOC#7 LOC#8 ) ^ E ( LOC#4 U LOC#6 ) . ( LOC#10 LOC#11 ) <EOS>
every/DT blank/JJ tolerance/NN God/NN is/VBZ a/DT <UNK>/NN of/IN lawmaker/NN and/CC a/DT closet/NN ./. <EOS>/<EOS>	LOC#1 LOC#2 LOC#3 := LOC#6 LOC#7 LOC#8 ^ LOC#11 <EOS>
every/DT annual/JJ shy/JJ chestnut/NN pat/VB less/JJR than/IN NUM/CD but/CC more/JJR than/IN NUM/CD tremendous/JJ and/CC different/JJ store/NN ./. <EOS>/<EOS>	LOC#1 LOC#2 LOC#3 := ( < LOC#7 && > LOC#11 ) LOC#4 . ( LOC#12 LOC#15 ^ LOC#14 LOC#15 ) <EOS>
zone/NN of/IN astronomer/NN recommend/VB or/CC drip/VB also/RB organ/NN of/IN hallway/NN nurse/NN ./. <EOS>/<EOS>	LOC#0 LOC#1 LOC#2 := E ( LOC#3 U LOC#5 ) . ( LOC#7 LOC#8 LOC#9 LOC#10 ) <EOS>
all/DT the/DT <UNK>/JJ rich/JJ mind/NN are/VBP also/RB typical/JJ converter/NN that/WDT do/VBP not/RB govern/VB nor/DT please/VB any/DT caring/JJ and/CC recondite/JJ residence/NN ./. <EOS>/<EOS>	LOC#2 LOC#3 LOC#4 := LOC#7 LOC#8 ^ ! E ( LOC#12 ^ LOC#14 ) . ( LOC#16 LOC#19 ^ LOC#18 LOC#19 ) <EOS>
descriptive/JJ minimal/JJ duty/NN are/VBP also/RB parallel/JJ <UNK>/NN that/WDT are/VBP repair/NN fellow/NN ./. <EOS>/<EOS>	LOC#0 LOC#1 LOC#2 := LOC#5 LOC#6 ^ LOC#9 LOC#10 <EOS>
mode/NN peep/VB three/JJ <UNK>/NN ,/. supportive/JJ <UNK>/NN ,/. and/CC manufacturing/NN pregnancy/NN ./. <EOS>/<EOS>	LOC#0 := E LOC#1 . ( LOC#2 LOC#3 ) ^ E LOC#1 . ( LOC#5 LOC#6 ) ^ E LOC#1 . ( LOC#9 LOC#10 ) <EOS>
a/DT nostalgic/JJ opposite/JJ membership/NN is/VBZ a/DT proportion/NN of/IN greedy/JJ <UNK>/NN that/WDT is/VBZ proud/JJ thoughtless/JJ <UNK>/NN ./. <EOS>/<EOS>	LOC#1 LOC#2 LOC#3 := LOC#6 LOC#7 LOC#8 LOC#9 ^ LOC#12 LOC#13 LOC#14 <EOS>
every/DT annoying/JJ shame/NN push/VB also/RB extreme/JJ eating/NN ,/. collaboration/NN rocket/NN and/CC still/JJ fortune/NN earnings/NN ./. <EOS>/<EOS>	LOC#1 LOC#2 := E LOC#3 . ( LOC#5 LOC#6 ) ^ E LOC#3 . ( LOC#8 LOC#9 ) ^ E LOC#3 . ( LOC#11 LOC#12 LOC#13 ) <EOS>
ally/NN of/IN <UNK>/NN are/VBP something/NN that/WDT reinforce/VB only/RB consequence/NN of/IN discreet/JJ plaintiff/NN ./. <EOS>/<EOS>	LOC#0 LOC#1 LOC#2 := A LOC#6 . ( LOC#8 LOC#9 LOC#10 LOC#11 ) <EOS>
a/DT random/JJ regular/JJ patience/NN specify/VB at/IN least/JJS NUM/CD or/CC no/DT more/JJR than/IN NUM/CD buddy/NN of/IN powerful/JJ importer/NN ./. <EOS>/<EOS>	LOC#1 LOC#2 LOC#3 := ( >= LOC#7 || <= LOC#12 ) LOC#4 . ( LOC#13 LOC#14 LOC#15 LOC#16 ) <EOS>
all/DT heartbreaking/JJ <UNK>/NN are/VBP also/RB sign/NN temple/NN of/IN episode/NN or/CC charming/JJ harvest/NN ./. <EOS>/<EOS>	LOC#1 LOC#2 := LOC#5 LOC#6 LOC#7 LOC#8 U LOC#10 LOC#11 <EOS>
a/DT Israeli/NN of/IN evident/JJ conservation/NN is/VBZ also/RB something/NN that/WDT occupy/VB sordid/JJ ,/. primary/JJ and/CC somber/JJ income/NN ./. <EOS>/<EOS>	LOC#1 LOC#2 LOC#3 LOC#4 := E LOC#9 . ( LOC#10 LOC#15 ^ LOC#12 LOC#15 ^ LOC#14 LOC#15 ) <EOS>
a/DT beer/NN is/VBZ also/RB a/DT serializable/JJ steel/NN and/CC a/DT additional/JJ second/NN language/NN ./. <EOS>/<EOS>	LOC#1 := LOC#5 LOC#6 ^ LOC#9 LOC#10 LOC#11 <EOS>
all/DT <UNK>/NN of/IN tedious/JJ grief/NN are/VBP religion/NN and/CC fence/NN of/IN reading/NN ./. <EOS>/<EOS>	LOC#1 LOC#2 LOC#3 LOC#4 := LOC#6 ^ LOC#8 LOC#9 LOC#10 <EOS>
a/DT abounding/JJ pole/NN is/VBZ also/RB a/DT obtainable/JJ vital/JJ artichoke/NN that/WDT is/VBZ fresh/JJ ./. <EOS>/<EOS>	LOC#1 LOC#2 := LOC#6 LOC#7 LOC#8 ^ LOC#11 <EOS>
daffy/JJ scenario/NN of/IN opening/NN are/VBP also/RB Jew/NN bug/NN or/CC annoyed/JJ founder/NN of/IN crowd/NN ./. <EOS>/<EOS>	LOC#0 LOC#1 LOC#2 LOC#3 := LOC#6 LOC#7 U LOC#9 LOC#10 LOC#11 LOC#12 <EOS>
<UNK>/NN of/IN tip/NN hostage/NN support/VB or/CC modify/VB no/DT survival/NN of/IN ill-informed/JJ corn/NN and/CC of/IN chemical/NN ./. <EOS>/<EOS>	LOC#0 LOC#1 LOC#2 LOC#3 := ! E ( LOC#4 ^ LOC#6 ) . ( LOC#8 LOC#9 LOC#10 LOC#11 ^ LOC#8 LOC#13 LOC#14 ) <EOS>
trauma/NN apologize/VB or/CC rejoice/VB only/RB <UNK>/NN ,/. wonderful/JJ blessing/NN passion/NN and/CC legitimate/JJ description/NN forum/NN ./. <EOS>/<EOS>	LOC#0 := A ( LOC#1 U LOC#3 ) . ( LOC#5 ) ^ A ( LOC#1 U LOC#3 ) . ( LOC#7 LOC#8 LOC#9 ) ^ A ( LOC#1 U LOC#3 ) . ( LOC#11 LOC#12 LOC#13 ) <EOS>
all/DT the/DT attractive/JJ <UNK>/JJ allegation/NN puncture/VB and/CC eat/VB only/RB nearby/JJ theology/NN of/IN denial/NN and/CC of/IN <UNK>/NN ./. <EOS>/<EOS>	LOC#2 LOC#3 LOC#4 := A ( LOC#5 ^ LOC#7 ) . ( LOC#9 LOC#10 LOC#11 LOC#12 ^ LOC#9 LOC#10 LOC#14 LOC#15 ) <EOS>
all/DT daily/JJ <UNK>/NN send/VB or/CC swim/VB only/RB assumption/NN developer/NN ,/. step/NN correspondent/NN ,/. and/CC quality/NN ./. <EOS>/<EOS>	LOC#1 LOC#2 := A ( LOC#3 U LOC#5 ) . ( LOC#7 LOC#8 ) ^ A ( LOC#3 U LOC#5 ) . ( LOC#10 LOC#11 ) ^ A ( LOC#3 U LOC#5 ) . ( LOC#14 ) <EOS>
shopping/NN are/VBP <UNK>/JJ wing/NN that/WDT are/VBP angle/NN of/IN compromise/NN ceiling/NN ./. <EOS>/<EOS>	LOC#0 := LOC#2 LOC#3 ^ LOC#6 LOC#7 LOC#8 LOC#9 <EOS>
a/DT platform/NN promise/NN of/IN aircraft/NN prick/VB less/JJR than/IN NUM/CD <UNK>/JJ ,/. moldy/JJ ,/. and/CC clever/JJ state/NN ./. <EOS>/<EOS>	LOC#1 LOC#2 LOC#3 LOC#4 := < LOC#8 LOC#5 . ( LOC#9 LOC#15 ^ LOC#11 LOC#15 ^ LOC#14 LOC#15 ) <EOS>
paint/NN of/IN suitable/JJ <UNK>/NN are/VBP also/RB volume/NN of/IN phone/NN or/CC neighboring/JJ hair/NN of/IN sleep/NN ./. <EOS>/<EOS>	LOC#0 LOC#1 LOC#2 LOC#3 := LOC#6 LOC#7 LOC#8 U LOC#10 LOC#11 LOC#12 LOC#13 <EOS>
a/DT wild/JJ gleaming/JJ ribbon/NN may/VB and/CC continue/VB also/RB instinct/NN date/NN and/CC red/JJ airplane/NN poverty/NN ./. <EOS>/<EOS>	LOC#1 LOC#2 LOC#3 := E ( LOC#4 ^ LOC#6 ) . ( LOC#8 LOC#9 ) ^ E ( LOC#4 ^ LOC#6 ) . ( LOC#11 LOC#12 LOC#13 ) <EOS>
everyday/JJ routine/NN species/NN are/VBP also/RB apathetic/JJ leg/NN and/CC teaspoon/NN fantasy/NN ./. <EOS>/<EOS>	LOC#0 LOC#1 LOC#2 := LOC#5 LOC#6 ^ LOC#8 LOC#9 <EOS>
every/DT ill/JJ homely/JJ explanation/NN is/VBZ also/RB a/DT bay/NN incident/NN and/CC a/DT standard/NN offer/NN of/IN pillow/NN ./. <EOS>/<EOS>	LOC#1 LOC#2 LOC#3 := LOC#7 LOC#8 ^ LOC#11 LOC#12 LOC#13 LOC#14 <EOS>
a/DT <UNK>/NN <UNK>/NN do/VBP not/RB fax/VB nor/DT pinch/VB any/DT bolt/NN of/IN forest/NN ./. <EOS>/<EOS>	LOC#1 LOC#2 := ! E ( LOC#5 ^ LOC#7 ) . ( LOC#9 LOC#10 LOC#11 ) <EOS>
library/NN of/IN debonair/JJ pain/NN cultivate/VB less/JJR than/IN NUM/CD and/CC more/JJR than/IN NUM/CD vegetable/NN of/IN <UNK>/JJ slope/NN ./. <EOS>/<EOS>	LOC#0 LOC#1 LOC#2 LOC#3 := ( < LOC#7 && > LOC#11 ) LOC#4 . ( LOC#12 LOC#13 LOC#14 LOC#15 ) <EOS>
reach/NN of/IN <UNK>/JJ instrument/NN sniff/VB or/CC bless/VB also/RB sequence/NN suggestion/NN ,/. slim/JJ failure/NN or/CC twist/NN hour/NN ./. <EOS>/<EOS>	LOC#0 LOC#1 LOC#2 LOC#3 := E ( LOC#4 U LOC#6 ) . ( LOC#8 LOC#9 U LOC#11 LOC#12 U LOC#14 LOC#15 ) <EOS>
all/DT reporting/NN of/IN prince/NN are/VBP also/RB spiteful/JJ gallery/NN of/IN leader/NN that/WDT do/VBP not/RB breathe/VB nor/DT violate/VB any/DT makeshift/JJ court/NN of/IN <UNK>/NN and/CC of/IN idiotic/JJ sympathy/NN ./. <EOS>/<EOS>	LOC#1 LOC#2 LOC#3 := LOC#6 LOC#7 LOC#8 LOC#9 ^ ! E ( LOC#13 ^ LOC#15 ) . ( LOC#17 LOC#18 LOC#19 LOC#20 ^ LOC#17 LOC#18 LOC#22 LOC#23 LOC#24 ) <EOS>
every/DT chair/NN quit/VB or/CC glue/VB e-mail/NN and/CC visit/NN ./. <EOS>/<EOS>	LOC#1 := E ( LOC#2 U LOC#4 ) . ( LOC#5 ) ^ E ( LOC#2 U LOC#4 ) . ( LOC#7 ) <EOS>
a/DT improved/JJ delivery/NN of/IN solution/NN is/VBZ a/DT grotesque/JJ ankle/NN or/CC a/DT landscape/NN <UNK>/NN ./. <EOS>/<EOS>	LOC#1 LOC#2 LOC#3 LOC#4 := LOC#7 LOC#8 U LOC#11 LOC#12 <EOS>
inmate/NN jar/NN of/IN wife/NN solve/VB and/CC shrink/VB only/RB non-living/JJ trouble/NN and/CC <UNK>/JJ channel/NN canvas/NN ./. <EOS>/<EOS>	LOC#0 LOC#1 LOC#2 LOC#3 := A ( LOC#4 ^ LOC#6 ) . ( LOC#8 LOC#9 ) ^ A ( LOC#4 ^ LOC#6 ) . ( LOC#11 LOC#12 LOC#13 ) <EOS>
a/DT axis/NN of/IN flaky/JJ reservation/NN tire/VB also/RB <UNK>/NN of/IN skull/NN and/CC of/IN teeny/JJ glass/NN ./. <EOS>/<EOS>	LOC#1 LOC#2 LOC#3 LOC#4 := E LOC#5 . ( LOC#7 LOC#8 LOC#9 ^ LOC#7 LOC#11 LOC#12 LOC#13 ) <EOS>
a/DT couch/NN of/IN gainful/JJ respondent/NN is/VBZ a/DT main/JJ hockey/NN that/WDT complete/VB cajun/JJ or/CC costly/JJ metadata/NN ./. <EOS>/<EOS>	LOC#1 LOC#2 LOC#3 LOC#4 := LOC#7 LOC#8 ^ E LOC#10 . ( LOC#11 LOC#14 U LOC#13 LOC#14 ) <EOS>
blocking/JJ relative/NN belong/VB exactly/RB NUM/CD king/NN of/IN facility/NN assignment/NN ./. <EOS>/<EOS>	LOC#0 LOC#1 := = LOC#4 LOC#2 . ( LOC#5 LOC#6 LOC#7 LOC#8 ) <EOS>
salad/NN of/IN Ms/NN education/NN are/VBP also/RB <UNK>/NN strain/NN that/WDT join/VB and/CC consist/VB also/RB temperature/NN of/IN magic/NN and/CC of/IN district/NN ./. <EOS>/<EOS>	LOC#0 LOC#1 LOC#2 LOC#3 := LOC#6 LOC#7 ^ E ( LOC#9 ^ LOC#11 ) . ( LOC#13 LOC#14 LOC#15 ^ LOC#13 LOC#17 LOC#18 ) <EOS>
every/DT mouse/NN of/IN murder/NN cooperation/NN is/VBZ also/RB a/DT various/JJ latter/JJ timestamp/NN that/WDT is/VBZ devil/NN of/IN suspicious/JJ requirement/NN ./. <EOS>/<EOS>	LOC#1 LOC#2 LOC#3 LOC#4 := LOC#8 LOC#9 LOC#10 ^ LOC#13 LOC#14 LOC#15 LOC#16 <EOS>
all/DT receiver/NN of/IN foregoing/JJ hash/NN are/VBP also/RB perception/NN farmer/NN that/WDT wreck/VB puzzled/JJ and/CC municipal/JJ expansion/NN ./. <EOS>/<EOS>	LOC#1 LOC#2 LOC#3 LOC#4 := LOC#7 LOC#8 ^ E LOC#10 . ( LOC#11 LOC#14 ^ LOC#13 LOC#14 ) <EOS>
all/DT the/DT drunk/JJ smell/NN lift/VB less/JJR than/IN NUM/CD advance/NN of/IN candidate/NN and/CC of/IN shooting/NN ./. <EOS>/<EOS>	LOC#2 LOC#3 := < LOC#7 LOC#4 . ( LOC#8 LOC#9 LOC#10 ^ LOC#8 LOC#12 LOC#13 ) <EOS>
