a/DT momentum/NN of/IN <UNK>/NN jewelry/NN is/VBZ a/DT decent/JJ skeleton/NN of/IN <UNK>/NN that/WDT is/VBZ practical/JJ ./. <EOS>/<EOS>	LOC#1 LOC#2 LOC#3 LOC#4 := LOC#7 LOC#8 LOC#9 LOC#10 ^ LOC#13 <EOS>
object/NN of/IN specialty/NN <UNK>/VB NUM/CD <UNK>/NN ,/. dreary/JJ food/NN alcohol/NN ,/. or/CC toothsome/JJ privilege/NN ./. <EOS>/<EOS>	LOC#0 LOC#1 LOC#2 := = LOC#4 LOC#3 . ( LOC#5 U LOC#7 LOC#8 LOC#9 U LOC#12 LOC#13 ) <EOS>
all/DT question/NN of/IN earthy/JJ motive/NN shiver/VB or/CC speak/VB only/RB measurement/JJ officer/NN ,/. smile/NN minister/NN and/CC cognitive/JJ sculpture/NN ./. <EOS>/<EOS>	LOC#1 LOC#2 LOC#3 LOC#4 := A ( LOC#5 U LOC#7 ) . ( LOC#9 LOC#10 ) ^ A ( LOC#5 U LOC#7 ) . ( LOC#12 LOC#13 ) ^ A ( LOC#5 U LOC#7 ) . ( LOC#15 LOC#16 ) <EOS>
acoustic/JJ explicit/JJ spectrum/NN do/VBP not/RB obtain/VB <UNK>/NN ,/. neural/JJ garage/NN frequency/NN or/CC prime/JJ citizen/NN ./. <EOS>/<EOS>	LOC#0 LOC#1 LOC#2 := ! E LOC#5 . ( LOC#6 U LOC#8 LOC#9 LOC#10 U LOC#12 LOC#13 ) <EOS>
crop/NN of/IN camp/NN unity/NN grab/VB at/IN least/JJS NUM/CD metal/NN ./. <EOS>/<EOS>	LOC#0 LOC#1 LOC#2 LOC#3 := >= LOC#7 LOC#4 . ( LOC#8 ) <EOS>
ossification/NN funriture/NN of/IN <UNK>/NN assess/VB only/RB quarterback/NN ,/. quick/JJ novel/NN and/CC unprecedented/JJ egg/NN ./. <EOS>/<EOS>	LOC#0 LOC#1 LOC#2 LOC#3 := A LOC#4 . ( LOC#6 ) ^ A LOC#4 . ( LOC#8 LOC#9 ) ^ A LOC#4 . ( LOC#11 LOC#12 ) <EOS>
stay/NN are/VBP remote/JJ psychedelic/JJ dispatcher/NN and/CC expensive/JJ district/NN of/IN <UNK>/NN ./. <EOS>/<EOS>	LOC#0 := LOC#2 LOC#3 LOC#4 ^ LOC#6 LOC#7 LOC#8 LOC#9 <EOS>
all/DT the/DT issue/NN data/NN of/IN struggle/NN are/VBP also/RB command/NN of/IN criminal/NN <UNK>/NN and/CC theoretical/JJ six/JJ condition/NN ./. <EOS>/<EOS>	LOC#2 LOC#3 LOC#4 LOC#5 := LOC#8 LOC#9 LOC#10 LOC#11 ^ LOC#13 LOC#14 LOC#15 <EOS>
every/DT grieving/JJ pillow/NN of/IN nation/NN argue/VB panic/NN and/CC incentive/NN ./. <EOS>/<EOS>	LOC#1 LOC#2 LOC#3 LOC#4 := E LOC#5 . ( LOC#6 ) ^ E LOC#5 . ( LOC#8 ) <EOS>
every/DT lackadaisical/JJ material/NN is/VBZ a/DT episode/NN of/IN worried/JJ implication/NN or/CC a/DT vacuous/JJ muddled/JJ hunger/NN ./. <EOS>/<EOS>	LOC#1 LOC#2 := LOC#5 LOC#6 LOC#7 LOC#8 U LOC#11 LOC#12 LOC#13 <EOS>
energy/NN of/IN pure/JJ disc/NN <UNK>/VB and/CC <UNK>/VB keen/JJ ,/. experimental/JJ and/CC psychological/JJ reader/NN ./. <EOS>/<EOS>	LOC#0 LOC#1 LOC#2 LOC#3 := E ( LOC#4 ^ LOC#6 ) . ( LOC#7 LOC#12 ^ LOC#9 LOC#12 ^ LOC#11 LOC#12 ) <EOS>
all/DT the/DT estimated/JJ rod/NN of/IN <UNK>/NN are/VBP history/NN or/CC miracle/NN of/IN <UNK>/NN <UNK>/NN ./. <EOS>/<EOS>	LOC#2 LOC#3 LOC#4 LOC#5 := LOC#7 U LOC#9 LOC#10 LOC#11 LOC#12 <EOS>
changeable/JJ medication/NN of/IN defendant/NN fetch/VB or/CC scratch/VB only/RB foundation/NN of/IN mineralized/JJ bush/NN or/CC of/IN lemon/NN ./. <EOS>/<EOS>	LOC#0 LOC#1 LOC#2 LOC#3 := A ( LOC#4 U LOC#6 ) . ( LOC#8 LOC#9 LOC#10 LOC#11 U LOC#8 LOC#13 LOC#14 ) <EOS>
every/DT proposed/JJ likely/JJ thread/NN prick/VB and/CC yell/VB achievement/NN of/IN old-fashioned/JJ second/NN and/CC of/IN electricity/NN ./. <EOS>/<EOS>	LOC#1 LOC#2 LOC#3 := E ( LOC#4 ^ LOC#6 ) . ( LOC#7 LOC#8 LOC#9 LOC#10 ^ LOC#7 LOC#12 LOC#13 ) <EOS>
all/DT prominent/JJ <UNK>/NN of/IN call/NN do/VBP not/RB destroy/VB nor/DT understand/VB any/DT furry/JJ quest/NN of/IN role/NN or/CC of/IN skeletogenic/JJ bank/NN ./. <EOS>/<EOS>	LOC#1 LOC#2 LOC#3 LOC#4 := ! E ( LOC#7 ^ LOC#9 ) . ( LOC#11 LOC#12 LOC#13 LOC#14 U LOC#11 LOC#12 LOC#16 LOC#17 LOC#18 ) <EOS>
male/JJ fiery/JJ <UNK>/NN embarrass/VB only/RB preference/NN of/IN short-term/JJ evolution/NN ./. <EOS>/<EOS>	LOC#0 LOC#1 LOC#2 := A LOC#3 . ( LOC#5 LOC#6 LOC#7 LOC#8 ) <EOS>
all/DT the/DT diverse/JJ counterpart/NN of/IN partnership/NN are/VBP also/RB abaft/JJ caprina/NN majority/NN that/WDT fasten/VB or/CC tuck/VB no/DT nervous/JJ procedure/NN ./. <EOS>/<EOS>	LOC#2 LOC#3 LOC#4 LOC#5 := LOC#8 LOC#9 LOC#10 ^ ! E ( LOC#12 ^ LOC#14 ) . ( LOC#16 LOC#17 ) <EOS>
all/DT the/DT spray/NN crest/NN of/IN oropharyngeal/NN are/VBP also/RB sale/NN house/NN of/IN classroom/NN that/WDT persuade/VB less/JJR than/IN NUM/CD or/CC not/RB less/JJR than/IN NUM/CD located/JJ ,/. solid/JJ or/CC next/JJ donor/NN ./. <EOS>/<EOS>	LOC#2 LOC#3 LOC#4 LOC#5 := LOC#8 LOC#9 LOC#10 LOC#11 ^ ( < LOC#16 || >= LOC#21 ) LOC#13 . ( LOC#22 LOC#27 U LOC#24 LOC#27 U LOC#26 LOC#27 ) <EOS>
all/DT surveillance/NN of/IN labored/JJ conduct/NN glue/VB or/CC thank/VB drunk/JJ and/CC temporary/JJ liver/NN ./. <EOS>/<EOS>	LOC#1 LOC#2 LOC#3 LOC#4 := E ( LOC#5 U LOC#7 ) . ( LOC#8 LOC#11 ^ LOC#10 LOC#11 ) <EOS>
literate/JJ evidence/NN of/IN contract/NN are/VBP also/RB artist/NN laughter/NN that/WDT are/VBP didactic/JJ ./. <EOS>/<EOS>	LOC#0 LOC#1 LOC#2 LOC#3 := LOC#6 LOC#7 ^ LOC#10 <EOS>
a/DT norm/NN assignment/NN of/IN juror/NN is/VBZ a/DT <UNK>/JJ frail/JJ customer/NN that/WDT is/VBZ pricey/JJ ./. <EOS>/<EOS>	LOC#1 LOC#2 LOC#3 LOC#4 := LOC#7 LOC#8 LOC#9 ^ LOC#12 <EOS>
every/DT deep/JJ far-flung/JJ <UNK>/NN haul/VB and/CC propose/VB also/RB beach/NN process/NN and/CC guarded/JJ closet/NN ./. <EOS>/<EOS>	LOC#1 LOC#2 LOC#3 := E ( LOC#4 ^ LOC#6 ) . ( LOC#8 LOC#9 ) ^ E ( LOC#4 ^ LOC#6 ) . ( LOC#11 LOC#12 ) <EOS>
a/DT judicial/JJ treaty/NN of/IN air/NN is/VBZ also/RB a/DT striking/JJ democratic/JJ offender/NN that/WDT is/VBZ hit/NN of/IN secretary/NN ./. <EOS>/<EOS>	LOC#1 LOC#2 LOC#3 LOC#4 := LOC#8 LOC#9 LOC#10 ^ LOC#13 LOC#14 LOC#15 <EOS>
<UNK>/NN agree/VB or/CC canvass/VB also/RB anterior/JJ or/CC violet/JJ fruit/NN ./. <EOS>/<EOS>	LOC#0 := E ( LOC#1 U LOC#3 ) . ( LOC#5 LOC#8 U LOC#7 LOC#8 ) <EOS>
all/DT axis/NN of/IN experience/NN category/NN are/VBP vote/NN thigh/NN of/IN belly/NN or/CC glad/JJ holy/JJ south/NN ./. <EOS>/<EOS>	LOC#1 LOC#2 LOC#3 LOC#4 := LOC#6 LOC#7 LOC#8 LOC#9 U LOC#11 LOC#12 LOC#13 <EOS>
all/DT the/DT thoracic/JJ form/NN rate/NN brief/VB and/CC peep/VB soft/JJ ,/. whispering/JJ or/CC <UNK>/JJ proximal/NN ./. <EOS>/<EOS>	LOC#2 LOC#3 LOC#4 := E ( LOC#5 ^ LOC#7 ) . ( LOC#8 LOC#13 U LOC#10 LOC#13 U LOC#12 LOC#13 ) <EOS>
all/DT asleep/JJ piano/NN are/VBP boyfriend/NN of/IN income/NN involvement/NN that/WDT <UNK>/VB or/CC consist/VB also/RB unaccountable/JJ <UNK>/NN of/IN literature/NN and/CC of/IN blond/JJ victory/NN ./. <EOS>/<EOS>	LOC#1 LOC#2 := LOC#4 LOC#5 LOC#6 LOC#7 ^ E ( LOC#9 U LOC#11 ) . ( LOC#13 LOC#14 LOC#15 LOC#16 ^ LOC#13 LOC#14 LOC#18 LOC#19 LOC#20 ) <EOS>
every/DT interview/NN canvas/NN of/IN boxing/NN is/VBZ also/RB a/DT germ/NN and/CC a/DT pork/NN of/IN search/NN hash/NN ./. <EOS>/<EOS>	LOC#1 LOC#2 LOC#3 LOC#4 := LOC#8 ^ LOC#11 LOC#12 LOC#13 LOC#14 <EOS>
missionary/NN distinction/NN imagine/VB only/RB year/NN <UNK>/NN ,/. instinctive/JJ operating/NN ,/. and/CC wedding/NN barrel/NN ./. <EOS>/<EOS>	LOC#0 LOC#1 := A LOC#2 . ( LOC#4 LOC#5 ) ^ A LOC#2 . ( LOC#7 LOC#8 ) ^ A LOC#2 . ( LOC#11 LOC#12 ) <EOS>
suit/NN of/IN entrepreneur/NN frontier/NN are/VBP internal/JJ pet/NN of/IN soho/NN or/CC unhappy/JJ hammer/NN of/IN measurement/NN ./. <EOS>/<EOS>	LOC#0 LOC#1 LOC#2 LOC#3 := LOC#5 LOC#6 LOC#7 LOC#8 U LOC#10 LOC#11 LOC#12 LOC#13 <EOS>
all/DT the/DT barn/NN heritage/NN of/IN concern/NN soak/VB less/JJR than/IN NUM/CD and/CC at/IN least/JJS NUM/CD gantry/NN of/IN secondary/JJ perspective/NN ./. <EOS>/<EOS>	LOC#2 LOC#3 LOC#4 LOC#5 := ( < LOC#9 && >= LOC#13 ) LOC#6 . ( LOC#14 LOC#15 LOC#16 LOC#17 ) <EOS>
all/DT square/NN of/IN reason/NN <UNK>/NN are/VBP <UNK>/NN branch/NN or/CC pregnant/JJ <UNK>/NN of/IN line/NN ./. <EOS>/<EOS>	LOC#1 LOC#2 LOC#3 LOC#4 := LOC#6 LOC#7 U LOC#9 LOC#10 LOC#11 LOC#12 <EOS>
all/DT merciful/JJ disturbing/JJ biology/NN tend/VB or/CC localize/VB no/DT <UNK>/NN or/CC crack/NN envelope/NN ./. <EOS>/<EOS>	LOC#1 LOC#2 LOC#3 := ! E ( LOC#4 ^ LOC#6 ) . ( LOC#8 U LOC#10 LOC#11 ) <EOS>
all/DT the/DT peer/NN of/IN independence/NN bend/VB or/CC born/VB ugliest/JJ <UNK>/NN facility/NN ,/. pant/NN and/CC publication/NN speed/NN ./. <EOS>/<EOS>	LOC#2 LOC#3 LOC#4 := E ( LOC#5 U LOC#7 ) . ( LOC#8 LOC#9 LOC#10 ) ^ E ( LOC#5 U LOC#7 ) . ( LOC#12 ) ^ E ( LOC#5 U LOC#7 ) . ( LOC#14 LOC#15 ) <EOS>
expression/NN genius/NN hug/VB envious/JJ sensation/NN ,/. boorish/JJ gym/NN and/CC zone/NN ./. <EOS>/<EOS>	LOC#0 LOC#1 := E LOC#2 . ( LOC#3 LOC#4 ) ^ E LOC#2 . ( LOC#6 LOC#7 ) ^ E LOC#2 . ( LOC#9 ) <EOS>
every/DT voter/NN of/IN elaborate/JJ fish/NN squash/VB only/RB continuing/JJ cable/NN ,/. skinny/JJ thoot/NN lighting/NN ,/. and/CC lush/JJ balance/NN ./. <EOS>/<EOS>	LOC#1 LOC#2 LOC#3 LOC#4 := A LOC#5 . ( LOC#7 LOC#8 ) ^ A LOC#5 . ( LOC#10 LOC#11 LOC#12 ) ^ A LOC#5 . ( LOC#15 LOC#16 ) <EOS>
every/DT piquant/JJ ability/NN <UNK>/NN familiarize/VB entity/NN riot/NN and/CC patrol/NN cycle/NN ./. <EOS>/<EOS>	LOC#1 LOC#2 LOC#3 := E LOC#4 . ( LOC#5 LOC#6 ) ^ E LOC#4 . ( LOC#8 LOC#9 ) <EOS>
a/DT alluring/JJ fluid/NN of/IN setting/NN stimulate/VB and/CC cut/VB only/RB penitent/JJ matrix/NN and/CC example/NN ./. <EOS>/<EOS>	LOC#1 LOC#2 LOC#3 LOC#4 := A ( LOC#5 ^ LOC#7 ) . ( LOC#9 LOC#10 ) ^ A ( LOC#5 ^ LOC#7 ) . ( LOC#12 ) <EOS>
all/DT lane/NN of/IN fund/NN football/NN are/VBP also/RB deafening/JJ blast/NN of/IN <UNK>/NN and/CC storm/NN Democrat/NN of/IN mathematics/NN ./. <EOS>/<EOS>	LOC#1 LOC#2 LOC#3 LOC#4 := LOC#7 LOC#8 LOC#9 LOC#10 ^ LOC#12 LOC#13 LOC#14 LOC#15 <EOS>
all/DT the/DT mechanic/NN charge/NN are/VBP also/RB blocking/JJ teacher/NN of/IN software/NN or/CC comparison/NN of/IN word/NN ./. <EOS>/<EOS>	LOC#2 LOC#3 := LOC#6 LOC#7 LOC#8 LOC#9 U LOC#11 LOC#12 LOC#13 <EOS>
maximum/JJ physics/NN are/VBP also/RB testimony/NN of/IN civilian/NN that/WDT squeeze/VB and/CC denotes/VB only/RB obvious/JJ ,/. specific/JJ or/CC gruesome/JJ bundle/NN ./. <EOS>/<EOS>	LOC#0 LOC#1 := LOC#4 LOC#5 LOC#6 ^ A ( LOC#8 ^ LOC#10 ) . ( LOC#12 LOC#17 U LOC#14 LOC#17 U LOC#16 LOC#17 ) <EOS>
all/DT the/DT domestic/JJ vocal/JJ cheese/NN bake/VB unexpected/JJ disappointment/NN moon/NN ,/. merchant/NN turn/NN ,/. and/CC horse/NN payment/NN ./. <EOS>/<EOS>	LOC#2 LOC#3 LOC#4 := E LOC#5 . ( LOC#6 LOC#7 LOC#8 ) ^ E LOC#5 . ( LOC#10 LOC#11 ) ^ E LOC#5 . ( LOC#14 LOC#15 ) <EOS>
ticket/NN of/IN <UNK>/JJ act/NN conclude/VB only/RB magenta/JJ ,/. royal/JJ ,/. and/CC manual/JJ pilot/NN ./. <EOS>/<EOS>	LOC#0 LOC#1 LOC#2 LOC#3 := A LOC#4 . ( LOC#6 LOC#12 ^ LOC#8 LOC#12 ^ LOC#11 LOC#12 ) <EOS>
a/DT undesirable/JJ invisible/JJ volume/NN is/VBZ also/RB something/NN that/WDT nod/VB and/CC <UNK>/VB perfect/JJ cholesterol/NN ,/. three/JJ offer/NN constraint/NN and/CC angel/NN ./. <EOS>/<EOS>	LOC#1 LOC#2 LOC#3 := E ( LOC#8 ^ LOC#10 ) . ( LOC#11 LOC#12 ) ^ E ( LOC#8 ^ LOC#10 ) . ( LOC#14 LOC#15 LOC#16 ) ^ E ( LOC#8 ^ LOC#10 ) . ( LOC#18 ) <EOS>
all/DT rival/NN of/IN publisher/NN memorise/VB only/RB <UNK>/JJ pair/NN ,/. <UNK>/JJ advice/NN ,/. and/CC <UNK>/NN Indian/NN ./. <EOS>/<EOS>	LOC#1 LOC#2 LOC#3 := A LOC#4 . ( LOC#6 LOC#7 ) ^ A LOC#4 . ( LOC#9 LOC#10 ) ^ A LOC#4 . ( LOC#13 LOC#14 ) <EOS>
away/JJ naive/JJ victim/NN expand/VB impressive/JJ field/NN gallium/NN ,/. multi-cellular/JJ <UNK>/NN rhinoceros/NN ,/. and/CC teenage/JJ weed/NN ./. <EOS>/<EOS>	LOC#0 LOC#1 LOC#2 := E LOC#3 . ( LOC#4 LOC#5 LOC#6 ) ^ E LOC#3 . ( LOC#8 LOC#9 LOC#10 ) ^ E LOC#3 . ( LOC#13 LOC#14 ) <EOS>
comparator/NN of/IN estimation/NN deceive/VB and/CC dominate/VB root/NN ,/. fire/NN and/CC nebulous/JJ lift/NN something/NN ./. <EOS>/<EOS>	LOC#0 LOC#1 LOC#2 := E ( LOC#3 ^ LOC#5 ) . ( LOC#6 ) ^ E ( LOC#3 ^ LOC#5 ) . ( LOC#8 ) ^ E ( LOC#3 ^ LOC#5 ) . ( LOC#10 LOC#11 LOC#12 ) <EOS>
developer/NN of/IN ununhexium/NN fuel/NN are/VBP also/RB marriage/NN competitor/NN of/IN <UNK>/NN or/CC guest/NN <UNK>/NN of/IN utility/NN ./. <EOS>/<EOS>	LOC#0 LOC#1 LOC#2 LOC#3 := LOC#6 LOC#7 LOC#8 LOC#9 U LOC#11 LOC#12 LOC#13 LOC#14 <EOS>
shelter/NN of/IN cluster/NN thanks/NN withdraw/VB NUM/CD trainer/NN of/IN horizon/NN ./. <EOS>/<EOS>	LOC#0 LOC#1 LOC#2 LOC#3 := = LOC#5 LOC#4 . ( LOC#6 LOC#7 LOC#8 ) <EOS>
all/DT sphere/NN of/IN sacred/JJ <UNK>/NN are/VBP mild/JJ phosphorus/NN of/IN sanction/NN that/WDT debug/VB more/JJR than/IN NUM/CD <UNK>/JJ coracoid/NN of/IN <UNK>/NN or/CC of/IN patience/NN ./. <EOS>/<EOS>	LOC#1 LOC#2 LOC#3 LOC#4 := LOC#6 LOC#7 LOC#8 LOC#9 ^ > LOC#14 LOC#11 . ( LOC#15 LOC#16 LOC#17 LOC#18 U LOC#15 LOC#16 LOC#20 LOC#21 ) <EOS>
all/DT the/DT stateless/JJ thirsty/JJ <UNK>/NN heap/VB and/CC excite/VB log/NN and/CC <UNK>/NN ./. <EOS>/<EOS>	LOC#2 LOC#3 LOC#4 := E ( LOC#5 ^ LOC#7 ) . ( LOC#8 ) ^ E ( LOC#5 ^ LOC#7 ) . ( LOC#10 ) <EOS>
a/DT sassy/JJ adaptor/NN of/IN <UNK>/NN hop/VB <UNK>/JJ senator/NN and/CC light/JJ bronze/NN finding/NN ./. <EOS>/<EOS>	LOC#1 LOC#2 LOC#3 LOC#4 := E LOC#5 . ( LOC#6 LOC#7 ) ^ E LOC#5 . ( LOC#9 LOC#10 LOC#11 ) <EOS>
all/DT the/DT new/JJ annoyed/JJ photograph/NN discover/VB or/CC ignore/VB also/RB synonymous/JJ ,/. several/JJ ,/. and/CC aware/JJ area/NN ./. <EOS>/<EOS>	LOC#2 LOC#3 LOC#4 := E ( LOC#5 U LOC#7 ) . ( LOC#9 LOC#15 ^ LOC#11 LOC#15 ^ LOC#14 LOC#15 ) <EOS>
particular/JJ aluminum/NN saddle/NN are/VBP also/RB receiver/NN swing/NN of/IN bullet/NN that/WDT are/VBP weekly/JJ ./. <EOS>/<EOS>	LOC#0 LOC#1 LOC#2 := LOC#5 LOC#6 LOC#7 LOC#8 ^ LOC#11 <EOS>
all/DT the/DT fiscal/JJ subatomic/JJ integrity/NN transform/VB no/DT <UNK>/NN of/IN severe/JJ composition/NN or/CC of/IN corner/NN ./. <EOS>/<EOS>	LOC#2 LOC#3 LOC#4 := ! E LOC#5 . ( LOC#7 LOC#8 LOC#9 LOC#10 U LOC#7 LOC#12 LOC#13 ) <EOS>
tremendous/JJ racial/JJ demonstration/NN do/VBP not/RB explore/VB irritating/JJ and/CC stale/JJ republic/NN ./. <EOS>/<EOS>	LOC#0 LOC#1 LOC#2 := ! E LOC#5 . ( LOC#6 LOC#9 ^ LOC#8 LOC#9 ) <EOS>
all/DT the/DT extension/NN of/IN seat/NN are/VBP strip/NN title/NN that/WDT learn/VB or/CC refer/VB also/RB glistening/JJ drawing/NN and/CC test/NN age/NN ./. <EOS>/<EOS>	LOC#2 LOC#3 LOC#4 := LOC#6 LOC#7 ^ E ( LOC#9 U LOC#11 ) . ( LOC#13 LOC#14 ) ^ E ( LOC#9 U LOC#11 ) . ( LOC#16 LOC#17 ) <EOS>
all/DT endurable/JJ nonstop/JJ tendency/NN are/VBP also/RB <UNK>/NN of/IN silky/JJ graduate/NN that/WDT do/VBP not/RB evaluate/VB any/DT devastating/JJ penalty/NN crowd/NN or/CC two/JJ prisoner/NN ./. <EOS>/<EOS>	LOC#1 LOC#2 LOC#3 := LOC#6 LOC#7 LOC#8 LOC#9 ^ ! E LOC#13 . ( LOC#15 LOC#16 LOC#17 U LOC#19 LOC#20 ) <EOS>
quarter/NN of/IN scandal/NN are/VBP <UNK>/JJ stupid/JJ wall/NN or/CC museum/NN <UNK>/NN of/IN white/NN ./. <EOS>/<EOS>	LOC#0 LOC#1 LOC#2 := LOC#4 LOC#5 LOC#6 U LOC#8 LOC#9 LOC#10 LOC#11 <EOS>
all/DT the/DT after/JJ insurance/NN of/IN retirement/NN are/VBP also/RB guttural/JJ well-being/NN tradition/NN and/CC migration/NN of/IN flawless/JJ mixture/NN ./. <EOS>/<EOS>	LOC#2 LOC#3 LOC#4 LOC#5 := LOC#8 LOC#9 LOC#10 ^ LOC#12 LOC#13 LOC#14 LOC#15 <EOS>
a/DT articulation/NN of/IN illusion/NN is/VBZ also/RB a/DT compensation/NN grass/NN of/IN German/NN that/WDT is/VBZ whole/JJ ./. <EOS>/<EOS>	LOC#1 LOC#2 LOC#3 := LOC#7 LOC#8 LOC#9 LOC#10 ^ LOC#13 <EOS>
all/DT dusty/JJ sake/NN are/VBP mask/NN of/IN localized/JJ metadata/NN that/WDT devote/VB only/RB ethical/JJ pickup/NN of/IN improvement/NN and/CC of/IN letter/NN ./. <EOS>/<EOS>	LOC#1 LOC#2 := LOC#4 LOC#5 LOC#6 LOC#7 ^ A LOC#9 . ( LOC#11 LOC#12 LOC#13 LOC#14 ^ LOC#11 LOC#12 LOC#16 LOC#17 ) <EOS>
a/DT ossified/JJ guarantee/NN enterprise/NN is/VBZ also/RB a/DT spouse/NN of/IN tabasco/NN that/WDT <UNK>/VB or/CC alert/VB also/RB gap/NN pig/NN ,/. growing/JJ hell/NN hydroxyapatite/NN ,/. and/CC graph/NN <UNK>/NN ./. <EOS>/<EOS>	LOC#1 LOC#2 LOC#3 := LOC#7 LOC#8 LOC#9 ^ E ( LOC#11 U LOC#13 ) . ( LOC#15 LOC#16 ) ^ E ( LOC#11 U LOC#13 ) . ( LOC#18 LOC#19 LOC#20 ) ^ E ( LOC#11 U LOC#13 ) . ( LOC#23 LOC#24 ) <EOS>
lanthanum/NN edition/NN frighten/VB NUM/CD supposed/JJ and/CC lame/JJ skill/NN ./. <EOS>/<EOS>	LOC#0 LOC#1 := = LOC#3 LOC#2 . ( LOC#4 LOC#7 ^ LOC#6 LOC#7 ) <EOS>
all/DT the/DT <UNK>/JJ unruly/JJ curve/NN are/VBP mammal/NN and/CC CEO/NN carrot/NN ./. <EOS>/<EOS>	LOC#2 LOC#3 LOC#4 := LOC#6 ^ LOC#8 LOC#9 <EOS>
all/DT the/DT goods/NN of/IN boson/NN radium/NN are/VBP visual/JJ program/NN that/WDT spill/VB and/CC scramble/VB rational/JJ English/NN of/IN trick/NN ./. <EOS>/<EOS>	LOC#2 LOC#3 LOC#4 LOC#5 := LOC#7 LOC#8 ^ E ( LOC#10 ^ LOC#12 ) . ( LOC#13 LOC#14 LOC#15 LOC#16 ) <EOS>
every/DT distance/NN abandon/VB only/RB kindhearted/JJ ,/. medical/JJ or/CC arrogant/JJ bench/NN ./. <EOS>/<EOS>	LOC#1 := A LOC#2 . ( LOC#4 LOC#9 U LOC#6 LOC#9 U LOC#8 LOC#9 ) <EOS>
a/DT outlet/NN of/IN intense/JJ position/NN do/VBP not/RB produce/VB any/DT kindly/JJ maker/NN of/IN bat/NN or/CC of/IN milky/JJ mandate/NN ./. <EOS>/<EOS>	LOC#1 LOC#2 LOC#3 LOC#4 := ! E LOC#7 . ( LOC#9 LOC#10 LOC#11 LOC#12 U LOC#9 LOC#10 LOC#14 LOC#15 LOC#16 ) <EOS>
all/DT the/DT steep/JJ roasted/JJ <UNK>/NN are/VBP server/NN transfer/NN that/WDT raise/VB also/RB financial/JJ and/CC plucky/JJ dealer/NN ./. <EOS>/<EOS>	LOC#2 LOC#3 LOC#4 := LOC#6 LOC#7 ^ E LOC#9 . ( LOC#11 LOC#14 ^ LOC#13 LOC#14 ) <EOS>
a/DT thinkable/JJ <UNK>/JJ jar/NN is/VBZ also/RB a/DT organic/JJ camera/NN matter/NN that/WDT is/VBZ accurate/JJ ./. <EOS>/<EOS>	LOC#1 LOC#2 LOC#3 := LOC#7 LOC#8 LOC#9 ^ LOC#12 <EOS>
every/DT storage/NN is/VBZ a/DT magnitude/NN of/IN import/NN that/WDT concede/VB and/CC artifact/VB worry/NN <UNK>/NN of/IN contest/NN ./. <EOS>/<EOS>	LOC#1 := LOC#4 LOC#5 LOC#6 ^ E ( LOC#8 ^ LOC#10 ) . ( LOC#11 LOC#12 LOC#13 LOC#14 ) <EOS>
all/DT datum/NN of/IN instructor/NN think/VB and/CC spit/VB only/RB non-vegetarian/JJ cook/NN <UNK>/NN ,/. business/NN and/CC foreign/JJ success/NN art/NN ./. <EOS>/<EOS>	LOC#1 LOC#2 LOC#3 := A ( LOC#4 ^ LOC#6 ) . ( LOC#8 LOC#9 LOC#10 ) ^ A ( LOC#4 ^ LOC#6 ) . ( LOC#12 ) ^ A ( LOC#4 ^ LOC#6 ) . ( LOC#14 LOC#15 LOC#16 ) <EOS>
a/DT strict/JJ <UNK>/NN wipe/VB more/JJR than/IN NUM/CD <UNK>/NN of/IN slippery/JJ transport/NN or/CC of/IN tasteless/JJ bee/NN ./. <EOS>/<EOS>	LOC#1 LOC#2 := > LOC#6 LOC#3 . ( LOC#7 LOC#8 LOC#9 LOC#10 U LOC#7 LOC#12 LOC#13 LOC#14 ) <EOS>
pharyngeal/JJ grain/NN assumption/NN diminish/VB and/CC constitute/VB rail/NN reliability/NN ,/. legislative/JJ expansion/NN and/CC injury/NN property/NN ./. <EOS>/<EOS>	LOC#0 LOC#1 LOC#2 := E ( LOC#3 ^ LOC#5 ) . ( LOC#6 LOC#7 ) ^ E ( LOC#3 ^ LOC#5 ) . ( LOC#9 LOC#10 ) ^ E ( LOC#3 ^ LOC#5 ) . ( LOC#12 LOC#13 ) <EOS>
bitter/JJ joint/NN of/IN plane/NN are/VBP something/NN that/WDT allow/VB or/CC drill/VB only/RB vivacious/JJ ,/. erect/JJ ,/. and/CC acrid/JJ stimulus/NN ./. <EOS>/<EOS>	LOC#0 LOC#1 LOC#2 LOC#3 := A ( LOC#7 U LOC#9 ) . ( LOC#11 LOC#17 ^ LOC#13 LOC#17 ^ LOC#16 LOC#17 ) <EOS>
fare/NN of/IN chronic/JJ loader/NN are/VBP also/RB hard/JJ refuge/NN challenge/NN that/WDT assume/VB and/CC navigate/VB also/RB fat/NN of/IN <UNK>/NN or/CC of/IN ill/JJ life/NN ./. <EOS>/<EOS>	LOC#0 LOC#1 LOC#2 LOC#3 := LOC#6 LOC#7 LOC#8 ^ E ( LOC#10 ^ LOC#12 ) . ( LOC#14 LOC#15 LOC#16 U LOC#14 LOC#18 LOC#19 LOC#20 ) <EOS>
every/DT <UNK>/NN of/IN delicate/JJ clip/NN is/VBZ also/RB a/DT <UNK>/JJ <UNK>/JJ intellectual/NN that/WDT is/VBZ pixel/NN of/IN best/JJ self-esteem/NN ./. <EOS>/<EOS>	LOC#1 LOC#2 LOC#3 LOC#4 := LOC#8 LOC#9 LOC#10 ^ LOC#13 LOC#14 LOC#15 LOC#16 <EOS>
every/DT loss/NN fear/NN is/VBZ also/RB a/DT healthy/JJ <UNK>/NN of/IN odontocyte/NN or/CC a/DT epidemic/NN of/IN basketball/NN <UNK>/NN ./. <EOS>/<EOS>	LOC#1 LOC#2 := LOC#6 LOC#7 LOC#8 LOC#9 U LOC#12 LOC#13 LOC#14 LOC#15 <EOS>
every/DT various/JJ squalid/JJ workplace/NN pursue/VB and/CC modify/VB only/RB workable/JJ earthquake/NN <UNK>/NN ,/. immigrant/NN chainsaw/NN ,/. and/CC sensitive/JJ radial/NN ./. <EOS>/<EOS>	LOC#1 LOC#2 LOC#3 := A ( LOC#4 ^ LOC#6 ) . ( LOC#8 LOC#9 LOC#10 ) ^ A ( LOC#4 ^ LOC#6 ) . ( LOC#12 LOC#13 ) ^ A ( LOC#4 ^ LOC#6 ) . ( LOC#16 LOC#17 ) <EOS>
all/DT the/DT <UNK>/JJ <UNK>/NN of/IN <UNK>/NN are/VBP spiky/JJ centrum/NN volunteer/NN that/WDT accomplish/VB ribbon/NN wave/NN or/CC captain/NN ./. <EOS>/<EOS>	LOC#2 LOC#3 LOC#4 LOC#5 := LOC#7 LOC#8 LOC#9 ^ E LOC#11 . ( LOC#12 LOC#13 U LOC#15 ) <EOS>
every/DT weakness/NN of/IN <UNK>/NN herd/NN recognise/VB and/CC wash/VB only/RB mute/JJ kindergarten/NN ,/. sloppy/JJ <UNK>/NN hospital/NN ,/. and/CC jealous/JJ pin/NN emergency/NN ./. <EOS>/<EOS>	LOC#1 LOC#2 LOC#3 LOC#4 := A ( LOC#5 ^ LOC#7 ) . ( LOC#9 LOC#10 ) ^ A ( LOC#5 ^ LOC#7 ) . ( LOC#12 LOC#13 LOC#14 ) ^ A ( LOC#5 ^ LOC#7 ) . ( LOC#17 LOC#18 LOC#19 ) <EOS>
handler/NN source/NN of/IN training/NN contemplate/VB only/RB <UNK>/NN jet/NN ,/. public/JJ elder/NN drop/NN and/CC <UNK>/JJ courtroom/NN giant/NN ./. <EOS>/<EOS>	LOC#0 LOC#1 LOC#2 LOC#3 := A LOC#4 . ( LOC#6 LOC#7 ) ^ A LOC#4 . ( LOC#9 LOC#10 LOC#11 ) ^ A LOC#4 . ( LOC#13 LOC#14 LOC#15 ) <EOS>
a/DT peace/NN pioneer/NN is/VBZ also/RB a/DT newspaper/NN phase/NN of/IN stadium/NN or/CC a/DT chestnut/NN of/IN spy/NN ./. <EOS>/<EOS>	LOC#1 LOC#2 := LOC#6 LOC#7 LOC#8 LOC#9 U LOC#12 LOC#13 LOC#14 <EOS>
<UNK>/NN of/IN legitimate/JJ coordinator/NN are/VBP exuberant/JJ bottom/NN snow/NN that/WDT are/VBP state/NN fashion/NN ./. <EOS>/<EOS>	LOC#0 LOC#1 LOC#2 LOC#3 := LOC#5 LOC#6 LOC#7 ^ LOC#10 LOC#11 <EOS>
congressional/JJ both/JJ hostage/NN are/VBP director/NN that/WDT are/VBP peak/NN of/IN absorbing/JJ teaching/NN ./. <EOS>/<EOS>	LOC#0 LOC#1 LOC#2 := LOC#4 ^ LOC#7 LOC#8 LOC#9 LOC#10 <EOS>
exotic/JJ sky/NN are/VBP also/RB gorgeous/JJ scheme/NN and/CC wildlife/NN of/IN abundant/JJ <UNK>/NN ./. <EOS>/<EOS>	LOC#0 LOC#1 := LOC#4 LOC#5 ^ LOC#7 LOC#8 LOC#9 LOC#10 <EOS>
cryptographic/JJ pleasure/NN of/IN disk/NN are/VBP also/RB pastor/NN of/IN unlike/JJ check/NN that/WDT are/VBP freshman/NN pension/NN ./. <EOS>/<EOS>	LOC#0 LOC#1 LOC#2 LOC#3 := LOC#6 LOC#7 LOC#8 LOC#9 ^ LOC#12 LOC#13 <EOS>
all/DT significant/JJ meaty/NN are/VBP also/RB performance/NN of/IN dumb/JJ maturity/NN or/CC <UNK>/NN of/IN movement/NN ./. <EOS>/<EOS>	LOC#1 LOC#2 := LOC#5 LOC#6 LOC#7 LOC#8 U LOC#10 LOC#11 LOC#12 <EOS>
every/DT reality/NN of/IN <UNK>/NN restriction/NN is/VBZ a/DT nippy/JJ minimum/NN rib/NN that/WDT tame/VB <UNK>/NN philosophy/NN and/CC retired/JJ associate/NN screening/NN ./. <EOS>/<EOS>	LOC#1 LOC#2 LOC#3 LOC#4 := LOC#7 LOC#8 LOC#9 ^ E LOC#11 . ( LOC#12 LOC#13 ) ^ E LOC#11 . ( LOC#15 LOC#16 LOC#17 ) <EOS>
every/DT casino/NN store/NN is/VBZ a/DT skirt/NN of/IN duty/NN and/CC a/DT beneficial/JJ change/NN of/IN drink/NN ./. <EOS>/<EOS>	LOC#1 LOC#2 := LOC#5 LOC#6 LOC#7 ^ LOC#10 LOC#11 LOC#12 LOC#13 <EOS>
all/DT capricious/JJ <UNK>/JJ cartilage/NN protect/VB and/CC enhance/VB also/RB jolly/JJ back/NN and/CC landmark/NN ball/NN ./. <EOS>/<EOS>	LOC#1 LOC#2 LOC#3 := E ( LOC#4 ^ LOC#6 ) . ( LOC#8 LOC#9 ) ^ E ( LOC#4 ^ LOC#6 ) . ( LOC#11 LOC#12 ) <EOS>
all/DT documentary/NN <UNK>/NN crawl/VB or/CC depreciated/VB only/RB ragu/NN of/IN message/NN and/CC of/IN delicious/JJ pot/NN ./. <EOS>/<EOS>	LOC#1 LOC#2 := A ( LOC#3 U LOC#5 ) . ( LOC#7 LOC#8 LOC#9 ^ LOC#7 LOC#11 LOC#12 LOC#13 ) <EOS>
all/DT origin/NN dress/NN last/VB and/CC fade/VB weekend/NN mercury/NN and/CC unequaled/JJ Russian/NN web/NN ./. <EOS>/<EOS>	LOC#1 LOC#2 := E ( LOC#3 ^ LOC#5 ) . ( LOC#6 LOC#7 ) ^ E ( LOC#3 ^ LOC#5 ) . ( LOC#9 LOC#10 LOC#11 ) <EOS>
organization/NN ectoderm/NN of/IN permission/NN fill/VB or/CC decrease/VB middle/JJ ,/. <UNK>/JJ and/CC fast/JJ formaggi/NN ./. <EOS>/<EOS>	LOC#0 LOC#1 LOC#2 LOC#3 := E ( LOC#4 U LOC#6 ) . ( LOC#7 LOC#12 ^ LOC#9 LOC#12 ^ LOC#11 LOC#12 ) <EOS>
every/DT ruthless/JJ emerging/JJ iterator/NN is/VBZ also/RB a/DT socket/NN circuit/NN that/WDT stumble/VB and/CC capture/VB element/NN revelation/NN ,/. revolution/NN and/CC guard/NN ./. <EOS>/<EOS>	LOC#1 LOC#2 LOC#3 := LOC#7 LOC#8 ^ E ( LOC#10 ^ LOC#12 ) . ( LOC#13 LOC#14 ) ^ E ( LOC#10 ^ LOC#12 ) . ( LOC#16 ) ^ E ( LOC#10 ^ LOC#12 ) . ( LOC#18 ) <EOS>
high-calorie/JJ behavior/NN are/VBP taste/NN of/IN deer/NN ingredient/NN and/CC language/NN of/IN pump/NN ./. <EOS>/<EOS>	LOC#0 LOC#1 := LOC#3 LOC#4 LOC#5 LOC#6 ^ LOC#8 LOC#9 LOC#10 <EOS>
every/DT plan/NN of/IN design/NN is/VBZ also/RB a/DT measly/JJ sense/NN of/IN biosphere/NN that/WDT is/VBZ auspicious/JJ prosecution/NN of/IN star/NN ./. <EOS>/<EOS>	LOC#1 LOC#2 LOC#3 := LOC#7 LOC#8 LOC#9 LOC#10 ^ LOC#13 LOC#14 LOC#15 LOC#16 <EOS>
all/DT platform/NN term/NN are/VBP also/RB well-off/JJ wrathful/JJ subsidy/NN that/WDT <UNK>/VB and/CC assist/VB <UNK>/NN pellet/NN ,/. outside/JJ <UNK>/NN ,/. and/CC selfish/JJ agenda/NN ./. <EOS>/<EOS>	LOC#1 LOC#2 := LOC#5 LOC#6 LOC#7 ^ E ( LOC#9 ^ LOC#11 ) . ( LOC#12 LOC#13 ) ^ E ( LOC#9 ^ LOC#11 ) . ( LOC#15 LOC#16 ) ^ E ( LOC#9 ^ LOC#11 ) . ( LOC#19 LOC#20 ) <EOS>
precementoblast/NN of/IN opening/NN excuse/NN are/VBP also/RB room/NN towel/NN of/IN monster/NN that/WDT bring/VB and/CC <UNK>/VB ritual/NN court/NN and/CC stereotyped/JJ plea/NN ./. <EOS>/<EOS>	LOC#0 LOC#1 LOC#2 LOC#3 := LOC#6 LOC#7 LOC#8 LOC#9 ^ E ( LOC#11 ^ LOC#13 ) . ( LOC#14 LOC#15 ) ^ E ( LOC#11 ^ LOC#13 ) . ( LOC#17 LOC#18 ) <EOS>
all/DT water/NN of/IN cord/NN membership/NN weigh/VB or/CC entitle/VB also/RB mesenchyme/NN author/NN and/CC writing/NN ./. <EOS>/<EOS>	LOC#1 LOC#2 LOC#3 LOC#4 := E ( LOC#5 U LOC#7 ) . ( LOC#9 LOC#10 ) ^ E ( LOC#5 U LOC#7 ) . ( LOC#12 ) <EOS>
every/DT ankle/NN is/VBZ also/RB a/DT <UNK>/NN of/IN breakable/JJ inflation/NN that/WDT strap/VB only/RB environmental/JJ hive/NN ,/. journalist/NN and/CC power/NN ./. <EOS>/<EOS>	LOC#1 := LOC#5 LOC#6 LOC#7 LOC#8 ^ A LOC#10 . ( LOC#12 LOC#13 ) ^ A LOC#10 . ( LOC#15 ) ^ A LOC#10 . ( LOC#17 ) <EOS>
a/DT female/JJ boring/JJ science/NN is/VBZ also/RB something/NN that/WDT fit/VB or/CC fold/VB only/RB accessible/JJ complex/NN panel/NN ,/. appreciation/NN burden/NN and/CC continued/JJ <UNK>/NN ./. <EOS>/<EOS>	LOC#1 LOC#2 LOC#3 := A ( LOC#8 U LOC#10 ) . ( LOC#12 LOC#13 LOC#14 ) ^ A ( LOC#8 U LOC#10 ) . ( LOC#16 LOC#17 ) ^ A ( LOC#8 U LOC#10 ) . ( LOC#19 LOC#20 ) <EOS>
identical/JJ meal/NN of/IN character/NN are/VBP private/JJ week/NN boot/NN that/WDT inherit/VB only/RB knife/NN of/IN outfit/NN and/CC of/IN interested/JJ explanation/NN ./. <EOS>/<EOS>	LOC#0 LOC#1 LOC#2 LOC#3 := LOC#5 LOC#6 LOC#7 ^ A LOC#9 . ( LOC#11 LOC#12 LOC#13 ^ LOC#11 LOC#15 LOC#16 LOC#17 ) <EOS>
ownership/NN win/NN of/IN ring/NN colour/VB or/CC renew/VB spokesman/NN of/IN rifle/NN or/CC of/IN hateful/JJ discrimination/NN ./. <EOS>/<EOS>	LOC#0 LOC#1 LOC#2 LOC#3 := E ( LOC#4 U LOC#6 ) . ( LOC#7 LOC#8 LOC#9 U LOC#7 LOC#11 LOC#12 LOC#13 ) <EOS>
