<UNK>/NN timber/NN of/IN carnivor/NN build/VB and/CC tackle/VB only/RB manner/NN ,/. structural/JJ mud/NN ,/. or/CC interest/NN account/NN ./. <EOS>/<EOS>	LOC#0 LOC#1 LOC#2 LOC#3 := A ( LOC#4 ^ LOC#6 ) . ( LOC#8 U LOC#10 LOC#11 U LOC#14 LOC#15 ) <EOS>
every/DT according/JJ <UNK>/JJ belt/NN is/VBZ a/DT <UNK>/NN coach/NN of/IN connection/NN that/WDT consists/VB and/CC mutter/VB only/RB succinct/JJ notice/NN sir/NN ,/. skeletal/JJ appearance/NN ,/. and/CC lunch/NN testing/NN ./. <EOS>/<EOS>	LOC#1 LOC#2 LOC#3 := LOC#6 LOC#7 LOC#8 LOC#9 ^ A ( LOC#11 ^ LOC#13 ) . ( LOC#15 LOC#16 LOC#17 ) ^ A ( LOC#11 ^ LOC#13 ) . ( LOC#19 LOC#20 ) ^ A ( LOC#11 ^ LOC#13 ) . ( LOC#23 LOC#24 ) <EOS>
butterfly/NN player/NN of/IN <UNK>/NN are/VBP also/RB grandparent/NN allegation/NN of/IN adolescent/NN that/WDT are/VBP staff/NN giardiniera/NN ./. <EOS>/<EOS>	LOC#0 LOC#1 LOC#2 LOC#3 := LOC#6 LOC#7 LOC#8 LOC#9 ^ LOC#12 LOC#13 <EOS>
all/DT the/DT abortive/JJ <UNK>/NN of/IN brush/NN are/VBP also/RB <UNK>/NN of/IN flower/NN <UNK>/NN and/CC flash/NN of/IN former/JJ background/NN ./. <EOS>/<EOS>	LOC#2 LOC#3 LOC#4 LOC#5 := LOC#8 LOC#9 LOC#10 LOC#11 ^ LOC#13 LOC#14 LOC#15 LOC#16 <EOS>
all/DT the/DT observer/NN of/IN emphasis/NN involve/VB or/CC exceed/VB no/DT exciting/JJ aspect/NN of/IN restriction/NN ./. <EOS>/<EOS>	LOC#2 LOC#3 LOC#4 := ! E ( LOC#5 ^ LOC#7 ) . ( LOC#9 LOC#10 LOC#11 LOC#12 ) <EOS>
president/NN of/IN centrum/NN are/VBP far/JJ therapy/NN of/IN chin/NN and/CC surgery/NN currency/NN of/IN gallium/NN ./. <EOS>/<EOS>	LOC#0 LOC#1 LOC#2 := LOC#4 LOC#5 LOC#6 LOC#7 ^ LOC#9 LOC#10 LOC#11 LOC#12 <EOS>
frightened/JJ journalist/NN veteran/NN are/VBP also/RB pleasant/JJ German/NN and/CC boom/NN of/IN installation/NN ./. <EOS>/<EOS>	LOC#0 LOC#1 LOC#2 := LOC#5 LOC#6 ^ LOC#8 LOC#9 LOC#10 <EOS>
all/DT fumbling/JJ stair/NN of/IN graduation/NN shoot/VB or/CC whirl/VB <UNK>/NN <UNK>/NN ,/. fee/NN interior/NN or/CC <UNK>/NN trade/NN ./. <EOS>/<EOS>	LOC#1 LOC#2 LOC#3 LOC#4 := E ( LOC#5 U LOC#7 ) . ( LOC#8 LOC#9 U LOC#11 LOC#12 U LOC#14 LOC#15 ) <EOS>
symbolic/JJ delightful/JJ sign/NN are/VBP also/RB sordid/JJ doorway/NN string/NN and/CC cycle/NN forelimb/NN ./. <EOS>/<EOS>	LOC#0 LOC#1 LOC#2 := LOC#5 LOC#6 LOC#7 ^ LOC#9 LOC#10 <EOS>
all/DT absent/JJ ruddy/JJ tester/NN are/VBP also/RB rim/NN of/IN amused/JJ bombing/NN that/WDT disclose/VB or/CC read/VB nasty/JJ loss/NN ./. <EOS>/<EOS>	LOC#1 LOC#2 LOC#3 := LOC#6 LOC#7 LOC#8 LOC#9 ^ E ( LOC#11 U LOC#13 ) . ( LOC#14 LOC#15 ) <EOS>
every/DT journey/NN of/IN handsome/JJ drug/NN is/VBZ also/RB a/DT disaster/NN thing/NN of/IN angel/NN that/WDT connect/VB or/CC differentiate/VB also/RB acquisition/NN of/IN flaky/JJ conspiracy/NN ./. <EOS>/<EOS>	LOC#1 LOC#2 LOC#3 LOC#4 := LOC#8 LOC#9 LOC#10 LOC#11 ^ E ( LOC#13 U LOC#15 ) . ( LOC#17 LOC#18 LOC#19 LOC#20 ) <EOS>
all/DT the/DT hollow/JJ sky/NN are/VBP classic/JJ dentine/NN that/WDT do/VBP not/RB lead/VB nor/DT wreck/VB any/DT comparison/NN accumulation/NN or/CC languid/JJ athlete/NN hall/NN ./. <EOS>/<EOS>	LOC#2 LOC#3 := LOC#5 LOC#6 ^ ! E ( LOC#10 ^ LOC#12 ) . ( LOC#14 LOC#15 U LOC#17 LOC#18 LOC#19 ) <EOS>
every/DT marketplace/NN of/IN xenon/NN proceed/VB or/CC believe/VB also/RB <UNK>/JJ <UNK>/NN ,/. <UNK>/NN motive/NN ,/. and/CC lobby/NN ./. <EOS>/<EOS>	LOC#1 LOC#2 LOC#3 := E ( LOC#4 U LOC#6 ) . ( LOC#8 LOC#9 ) ^ E ( LOC#4 U LOC#6 ) . ( LOC#11 LOC#12 ) ^ E ( LOC#4 U LOC#6 ) . ( LOC#15 ) <EOS>
engine/NN timing/NN meet/VB and/CC unveil/VB only/RB <UNK>/JJ tag/NN ,/. cargo/NN state/NN and/CC silent/JJ version/NN desire/NN ./. <EOS>/<EOS>	LOC#0 LOC#1 := A ( LOC#2 ^ LOC#4 ) . ( LOC#6 LOC#7 ) ^ A ( LOC#2 ^ LOC#4 ) . ( LOC#9 LOC#10 ) ^ A ( LOC#2 ^ LOC#4 ) . ( LOC#12 LOC#13 LOC#14 ) <EOS>
commitment/NN of/IN greatest/JJ <UNK>/NN transmit/VB also/RB gabby/JJ cholesterol/NN temperature/NN ,/. suite/NN and/CC address/NN ./. <EOS>/<EOS>	LOC#0 LOC#1 LOC#2 LOC#3 := E LOC#4 . ( LOC#6 LOC#7 LOC#8 ) ^ E LOC#4 . ( LOC#10 ) ^ E LOC#4 . ( LOC#12 ) <EOS>
all/DT pin/NN of/IN time/NN are/VBP also/RB loan/NN of/IN <UNK>/NN relative/NN that/WDT dismiss/VB at/IN most/JJS NUM/CD or/CC at/IN least/JJS NUM/CD outfit/NN of/IN peppadew/NN ./. <EOS>/<EOS>	LOC#1 LOC#2 LOC#3 := LOC#6 LOC#7 LOC#8 LOC#9 ^ ( <= LOC#14 || >= LOC#18 ) LOC#11 . ( LOC#19 LOC#20 LOC#21 ) <EOS>
retailer/NN of/IN kiss/NN are/VBP also/RB eastern/JJ essence/NN of/IN <UNK>/NN or/CC hypertrophic/JJ instance/NN of/IN frequency/NN ./. <EOS>/<EOS>	LOC#0 LOC#1 LOC#2 := LOC#5 LOC#6 LOC#7 LOC#8 U LOC#10 LOC#11 LOC#12 LOC#13 <EOS>
a/DT sock/NN of/IN consecutive/JJ silicon/NN dedicate/VB or/CC jam/VB only/RB guy/NN acid/NN and/CC vertebral/JJ <UNK>/NN ./. <EOS>/<EOS>	LOC#1 LOC#2 LOC#3 LOC#4 := A ( LOC#5 U LOC#7 ) . ( LOC#9 LOC#10 ) ^ A ( LOC#5 U LOC#7 ) . ( LOC#12 LOC#13 ) <EOS>
standard/NN of/IN effort/NN lemon/NN trim/VB and/CC are/VB also/RB exclusive/JJ lepidotrichium/NN and/CC farmer/NN ./. <EOS>/<EOS>	LOC#0 LOC#1 LOC#2 LOC#3 := E ( LOC#4 ^ LOC#6 ) . ( LOC#8 LOC#9 ) ^ E ( LOC#4 ^ LOC#6 ) . ( LOC#11 ) <EOS>
<UNK>/NN of/IN math/NN are/VBP also/RB virtual/JJ resident/NN or/CC charge/NN of/IN skillful/JJ <UNK>/NN ./. <EOS>/<EOS>	LOC#0 LOC#1 LOC#2 := LOC#5 LOC#6 U LOC#8 LOC#9 LOC#10 LOC#11 <EOS>
bridge/NN of/IN expander/NN are/VBP supervisor/NN of/IN scrollbar/NN heel/NN and/CC <UNK>/NN of/IN garage/NN formula/NN ./. <EOS>/<EOS>	LOC#0 LOC#1 LOC#2 := LOC#4 LOC#5 LOC#6 LOC#7 ^ LOC#9 LOC#10 LOC#11 LOC#12 <EOS>
a/DT sturdy/JJ argon/NN temple/NN support/VB and/CC proclaim/VB also/RB minor/JJ imagination/NN and/CC axiomatic/JJ nickel/NN ./. <EOS>/<EOS>	LOC#1 LOC#2 LOC#3 := E ( LOC#4 ^ LOC#6 ) . ( LOC#8 LOC#9 ) ^ E ( LOC#4 ^ LOC#6 ) . ( LOC#11 LOC#12 ) <EOS>
a/DT physician/NN is/VBZ a/DT slope/NN of/IN verbal/JJ architecture/NN that/WDT portray/VB also/RB fanatical/JJ and/CC magical/JJ <UNK>/NN ./. <EOS>/<EOS>	LOC#1 := LOC#4 LOC#5 LOC#6 LOC#7 ^ E LOC#9 . ( LOC#11 LOC#14 ^ LOC#13 LOC#14 ) <EOS>
all/DT the/DT liberty/NN gallery/NN scorch/VB also/RB thankful/JJ machine/NN and/CC rocket/NN meat/NN ./. <EOS>/<EOS>	LOC#2 LOC#3 := E LOC#4 . ( LOC#6 LOC#7 ) ^ E LOC#4 . ( LOC#9 LOC#10 ) <EOS>
air/NN infant/NN of/IN pine/NN are/VBP also/RB idea/NN of/IN portrait/NN mom/NN that/WDT tickle/VB or/CC admit/VB <UNK>/NN <UNK>/NN and/CC cell/NN ./. <EOS>/<EOS>	LOC#0 LOC#1 LOC#2 LOC#3 := LOC#6 LOC#7 LOC#8 LOC#9 ^ E ( LOC#11 U LOC#13 ) . ( LOC#14 LOC#15 ) ^ E ( LOC#11 U LOC#13 ) . ( LOC#17 ) <EOS>
all/DT habit/NN provision/NN are/VBP also/RB <UNK>/NN meeting/NN that/WDT prohibit/VB no/DT more/JJR than/IN NUM/CD foregoing/JJ peasant/NN of/IN post/NN ./. <EOS>/<EOS>	LOC#1 LOC#2 := LOC#5 LOC#6 ^ <= LOC#12 LOC#8 . ( LOC#13 LOC#14 LOC#15 LOC#16 ) <EOS>
fool/NN rage/NN are/VBP also/RB box/NN emotion/NN of/IN reflection/NN that/WDT are/VBP five/JJ ./. <EOS>/<EOS>	LOC#0 LOC#1 := LOC#4 LOC#5 LOC#6 LOC#7 ^ LOC#10 <EOS>
language/NN listen/VB and/CC <UNK>/VB only/RB used/JJ telescope/NN of/IN owner/NN and/CC of/IN stove/NN ./. <EOS>/<EOS>	LOC#0 := A ( LOC#1 ^ LOC#3 ) . ( LOC#5 LOC#6 LOC#7 LOC#8 ^ LOC#5 LOC#6 LOC#10 LOC#11 ) <EOS>
pepperoni/NN stimulus/NN of/IN advance/NN are/VBP also/RB Muslim/NN traveler/NN and/CC favorable/JJ <UNK>/NN of/IN <UNK>/NN ./. <EOS>/<EOS>	LOC#0 LOC#1 LOC#2 LOC#3 := LOC#6 LOC#7 ^ LOC#9 LOC#10 LOC#11 LOC#12 <EOS>
superior/JJ forum/NN do/VBP not/RB solve/VB following/JJ supporter/NN of/IN emergency/NN or/CC of/IN mechanical/JJ entertainment/NN ./. <EOS>/<EOS>	LOC#0 LOC#1 := ! E LOC#4 . ( LOC#5 LOC#6 LOC#7 LOC#8 U LOC#5 LOC#6 LOC#10 LOC#11 LOC#12 ) <EOS>
all/DT spokesman/NN waist/NN stir/VB remarkable/JJ kindergarten/NN complex/NN and/CC disgusted/JJ <UNK>/NN ./. <EOS>/<EOS>	LOC#1 LOC#2 := E LOC#3 . ( LOC#4 LOC#5 LOC#6 ) ^ E LOC#3 . ( LOC#8 LOC#9 ) <EOS>
every/DT subject/NN dance/NN is/VBZ a/DT deranged/JJ overrated/JJ legislator/NN or/CC a/DT trimestral/JJ cricket/NN ./. <EOS>/<EOS>	LOC#1 LOC#2 := LOC#5 LOC#6 LOC#7 U LOC#10 LOC#11 <EOS>
mutual/JJ documentary/NN store/NN are/VBP also/RB provider/NN of/IN hapless/JJ stack/NN and/CC cultured/JJ horror/NN ./. <EOS>/<EOS>	LOC#0 LOC#1 LOC#2 := LOC#5 LOC#6 LOC#7 LOC#8 ^ LOC#10 LOC#11 <EOS>
transformation/NN of/IN chief/NN expedition/NN like/VB and/CC convert/VB only/RB frequent/JJ relation/NN ,/. festive/JJ mushroom/NN ,/. and/CC statistical/JJ actor/NN photography/NN ./. <EOS>/<EOS>	LOC#0 LOC#1 LOC#2 LOC#3 := A ( LOC#4 ^ LOC#6 ) . ( LOC#8 LOC#9 ) ^ A ( LOC#4 ^ LOC#6 ) . ( LOC#11 LOC#12 ) ^ A ( LOC#4 ^ LOC#6 ) . ( LOC#15 LOC#16 LOC#17 ) <EOS>
a/DT rehabilitation/NN is/VBZ also/RB a/DT <UNK>/NN case/NN of/IN <UNK>/NN or/CC a/DT spicy/JJ counter/NN of/IN side/NN ./. <EOS>/<EOS>	LOC#1 := LOC#5 LOC#6 LOC#7 LOC#8 U LOC#11 LOC#12 LOC#13 LOC#14 <EOS>
all/DT the/DT <UNK>/NN truck/NN <UNK>/VB or/CC affect/VB corn/NN power/NN ,/. moment/NN future/NN and/CC hormone/NN <UNK>/NN ./. <EOS>/<EOS>	LOC#2 LOC#3 := E ( LOC#4 U LOC#6 ) . ( LOC#7 LOC#8 ) ^ E ( LOC#4 U LOC#6 ) . ( LOC#10 LOC#11 ) ^ E ( LOC#4 U LOC#6 ) . ( LOC#13 LOC#14 ) <EOS>
every/DT organization/NN comply/VB south/NN and/CC serious/JJ expense/NN ./. <EOS>/<EOS>	LOC#1 := E LOC#2 . ( LOC#3 ) ^ E LOC#2 . ( LOC#5 LOC#6 ) <EOS>
a/DT equation/NN of/IN delivery/NN is/VBZ something/NN that/WDT do/VBP not/RB <UNK>/VB nor/DT regain/VB any/DT glossy/JJ banker/NN of/IN <UNK>/NN and/CC of/IN conscience/NN ./. <EOS>/<EOS>	LOC#1 LOC#2 LOC#3 := ! E ( LOC#9 ^ LOC#11 ) . ( LOC#13 LOC#14 LOC#15 LOC#16 ^ LOC#13 LOC#14 LOC#18 LOC#19 ) <EOS>
every/DT medication/NN fisherman/NN is/VBZ also/RB a/DT marvelous/JJ pet/NN or/CC a/DT regional/JJ trite/JJ trait/NN ./. <EOS>/<EOS>	LOC#1 LOC#2 := LOC#6 LOC#7 U LOC#10 LOC#11 LOC#12 <EOS>
landmark/NN election/NN of/IN meal/NN invent/VB and/CC mediate/VB also/RB bed/NN ,/. existing/JJ gear/NN lead/NN and/CC <UNK>/NN minority/NN ./. <EOS>/<EOS>	LOC#0 LOC#1 LOC#2 LOC#3 := E ( LOC#4 ^ LOC#6 ) . ( LOC#8 ) ^ E ( LOC#4 ^ LOC#6 ) . ( LOC#10 LOC#11 LOC#12 ) ^ E ( LOC#4 ^ LOC#6 ) . ( LOC#14 LOC#15 ) <EOS>
bewildered/JJ efficient/JJ chemistry/NN are/VBP anything/NN that/WDT become/VB also/RB <UNK>/JJ irony/NN business/NN and/CC heavy/JJ ease/NN trial/NN ./. <EOS>/<EOS>	LOC#0 LOC#1 LOC#2 := E LOC#6 . ( LOC#8 LOC#9 LOC#10 ) ^ E LOC#6 . ( LOC#12 LOC#13 LOC#14 ) <EOS>
a/DT <UNK>/NN ecosystem/NN of/IN score/NN skip/VB also/RB liability/NN midst/NN and/CC curly/JJ <UNK>/NN ./. <EOS>/<EOS>	LOC#1 LOC#2 LOC#3 LOC#4 := E LOC#5 . ( LOC#7 LOC#8 ) ^ E LOC#5 . ( LOC#10 LOC#11 ) <EOS>
cheesey/JJ eligible/JJ mediator/NN do/VBP not/RB warn/VB dominant/JJ and/CC coherent/JJ empire/NN ./. <EOS>/<EOS>	LOC#0 LOC#1 LOC#2 := ! E LOC#5 . ( LOC#6 LOC#9 ^ LOC#8 LOC#9 ) <EOS>
labor/NN are/VBP anything/NN that/WDT consume/VB and/CC prompt/VB only/RB draconian/JJ ,/. lovely/JJ ,/. or/CC differentiated/JJ trace/NN ./. <EOS>/<EOS>	LOC#0 := A ( LOC#4 ^ LOC#6 ) . ( LOC#8 LOC#14 U LOC#10 LOC#14 U LOC#13 LOC#14 ) <EOS>
all/DT the/DT <UNK>/NN curl/VB or/CC contribute/VB also/RB virus/NN of/IN right/NN ./. <EOS>/<EOS>	LOC#2 := E ( LOC#3 U LOC#5 ) . ( LOC#7 LOC#8 LOC#9 ) <EOS>
all/DT frozen/JJ spouse/NN of/IN norm/NN boost/VB <UNK>/NN <UNK>/NN ,/. <UNK>/NN and/CC lopsided/JJ code/NN separation/NN ./. <EOS>/<EOS>	LOC#1 LOC#2 LOC#3 LOC#4 := E LOC#5 . ( LOC#6 LOC#7 ) ^ E LOC#5 . ( LOC#9 ) ^ E LOC#5 . ( LOC#11 LOC#12 LOC#13 ) <EOS>
a/DT name/NN of/IN adjustment/NN detect/VB not/RB less/JJR than/IN NUM/CD and/CC at/IN most/JJS NUM/CD brawny/JJ and/CC perceived/JJ <UNK>/NN ./. <EOS>/<EOS>	LOC#1 LOC#2 LOC#3 := ( >= LOC#8 && <= LOC#12 ) LOC#4 . ( LOC#13 LOC#16 ^ LOC#15 LOC#16 ) <EOS>
every/DT income/NN of/IN county/NN reorganize/VB also/RB concerned/JJ repair/NN ,/. extreme/JJ exchange/NN counselor/NN and/CC neon/NN ./. <EOS>/<EOS>	LOC#1 LOC#2 LOC#3 := E LOC#4 . ( LOC#6 LOC#7 ) ^ E LOC#4 . ( LOC#9 LOC#10 LOC#11 ) ^ E LOC#4 . ( LOC#13 ) <EOS>
a/DT <UNK>/JJ seal/NN of/IN <UNK>/NN decide/VB and/CC obstruct/VB only/RB unbecoming/JJ teen/NN and/CC phase/NN violation/NN ./. <EOS>/<EOS>	LOC#1 LOC#2 LOC#3 LOC#4 := A ( LOC#5 ^ LOC#7 ) . ( LOC#9 LOC#10 ) ^ A ( LOC#5 ^ LOC#7 ) . ( LOC#12 LOC#13 ) <EOS>
tennis/NN of/IN bicycle/NN chunk/NN commence/VB not/RB less/JJR than/IN NUM/CD downtown/JJ reputation/NN of/IN angle/NN and/CC of/IN civilian/NN ./. <EOS>/<EOS>	LOC#0 LOC#1 LOC#2 LOC#3 := >= LOC#8 LOC#4 . ( LOC#9 LOC#10 LOC#11 LOC#12 ^ LOC#9 LOC#10 LOC#14 LOC#15 ) <EOS>
all/DT the/DT assistance/NN of/IN sedate/JJ herd/NN cooperate/VB more/JJR than/IN NUM/CD and/CC less/JJR than/IN NUM/CD positive/JJ complicated/JJ psychologist/NN ./. <EOS>/<EOS>	LOC#2 LOC#3 LOC#4 LOC#5 := ( > LOC#9 && < LOC#13 ) LOC#6 . ( LOC#14 LOC#15 LOC#16 ) <EOS>
a/DT <UNK>/NN of/IN outstanding/JJ secretary/NN is/VBZ also/RB something/NN that/WDT march/VB quizzical/JJ existence/NN ,/. hysterical/JJ carbon/NN and/CC prior/JJ compensation/NN prosecution/NN ./. <EOS>/<EOS>	LOC#1 LOC#2 LOC#3 LOC#4 := E LOC#9 . ( LOC#10 LOC#11 ) ^ E LOC#9 . ( LOC#13 LOC#14 ) ^ E LOC#9 . ( LOC#16 LOC#17 LOC#18 ) <EOS>
<UNK>/JJ auto/NN of/IN lid/NN are/VBP buyer/NN of/IN <UNK>/JJ apology/NN that/WDT confuse/VB or/CC soar/VB tropical/JJ content/NN ,/. artificial/JJ participant/NN observation/NN ,/. and/CC chapter/NN infrastructure/NN ./. <EOS>/<EOS>	LOC#0 LOC#1 LOC#2 LOC#3 := LOC#5 LOC#6 LOC#7 LOC#8 ^ E ( LOC#10 U LOC#12 ) . ( LOC#13 LOC#14 ) ^ E ( LOC#10 U LOC#12 ) . ( LOC#16 LOC#17 LOC#18 ) ^ E ( LOC#10 U LOC#12 ) . ( LOC#21 LOC#22 ) <EOS>
all/DT the/DT identifiable/JJ daily/JJ booth/NN borrow/VB only/RB emotional/JJ and/CC husky/JJ statute/NN ./. <EOS>/<EOS>	LOC#2 LOC#3 LOC#4 := A LOC#5 . ( LOC#7 LOC#10 ^ LOC#9 LOC#10 ) <EOS>
every/DT worldwide/JJ passing/JJ rating/NN coordinate/VB and/CC buzz/VB craven/JJ supply/NN cup/NN ,/. adequate/JJ procedure/NN ,/. and/CC <UNK>/JJ accuracy/NN <UNK>/NN ./. <EOS>/<EOS>	LOC#1 LOC#2 LOC#3 := E ( LOC#4 ^ LOC#6 ) . ( LOC#7 LOC#8 LOC#9 ) ^ E ( LOC#4 ^ LOC#6 ) . ( LOC#11 LOC#12 ) ^ E ( LOC#4 ^ LOC#6 ) . ( LOC#15 LOC#16 LOC#17 ) <EOS>
pan/NN are/VBP also/RB everything/NN that/WDT enlighten/VB or/CC testify/VB parish/NN and/CC odontogenic/JJ argument/NN ./. <EOS>/<EOS>	LOC#0 := E ( LOC#5 U LOC#7 ) . ( LOC#8 ) ^ E ( LOC#5 U LOC#7 ) . ( LOC#10 LOC#11 ) <EOS>
all/DT garrulous/JJ fearless/JJ opera/NN clap/VB mozzarella/NN of/IN brick/NN ./. <EOS>/<EOS>	LOC#1 LOC#2 LOC#3 := E LOC#4 . ( LOC#5 LOC#6 LOC#7 ) <EOS>
<UNK>/NN of/IN variety/NN are/VBP also/RB watery/JJ yard/NN that/WDT are/VBP start/JJ struggle/NN <UNK>/NN ./. <EOS>/<EOS>	LOC#0 LOC#1 LOC#2 := LOC#5 LOC#6 ^ LOC#9 LOC#10 LOC#11 <EOS>
every/DT dangerous/JJ <UNK>/NN is/VBZ also/RB a/DT problem/NN of/IN debut/NN layer/NN that/WDT is/VBZ block/NN deputy/NN ./. <EOS>/<EOS>	LOC#1 LOC#2 := LOC#6 LOC#7 LOC#8 LOC#9 ^ LOC#12 LOC#13 <EOS>
all/DT the/DT interclavicle/NN of/IN unit/NN are/VBP ahead/JJ soup/NN of/IN <UNK>/NN that/WDT spare/VB or/CC empty/VB only/RB classy/JJ lady/NN prediction/NN and/CC yummy/JJ contributor/NN ./. <EOS>/<EOS>	LOC#2 LOC#3 LOC#4 := LOC#6 LOC#7 LOC#8 LOC#9 ^ A ( LOC#11 U LOC#13 ) . ( LOC#15 LOC#16 LOC#17 ) ^ A ( LOC#11 U LOC#13 ) . ( LOC#19 LOC#20 ) <EOS>
every/DT flake/NN palm/NN of/IN depth/NN is/VBZ also/RB a/DT helpful/JJ harmony/NN of/IN <UNK>/NN and/CC a/DT basketball/NN of/IN old/JJ concentration/NN ./. <EOS>/<EOS>	LOC#1 LOC#2 LOC#3 LOC#4 := LOC#8 LOC#9 LOC#10 LOC#11 ^ LOC#14 LOC#15 LOC#16 LOC#17 <EOS>
all/DT the/DT turn/NN of/IN paired/JJ equity/NN appear/VB no/DT more/JJR than/IN NUM/CD or/CC at/IN least/JJS NUM/CD unhealthy/JJ and/CC detailed/JJ commander/NN ./. <EOS>/<EOS>	LOC#2 LOC#3 LOC#4 LOC#5 := ( <= LOC#10 || >= LOC#14 ) LOC#6 . ( LOC#15 LOC#18 ^ LOC#17 LOC#18 ) <EOS>
every/DT <UNK>/NN of/IN romantic/JJ chamber/NN perform/VB more/JJR than/IN NUM/CD evasive/JJ correlation/NN <UNK>/NN or/CC spinal/JJ senator/NN efficiency/NN ./. <EOS>/<EOS>	LOC#1 LOC#2 LOC#3 LOC#4 := > LOC#8 LOC#5 . ( LOC#9 LOC#10 LOC#11 U LOC#13 LOC#14 LOC#15 ) <EOS>
explanation/NN of/IN budget/NN are/VBP also/RB <UNK>/NN monkey/NN of/IN mansion/NN that/WDT grease/VB also/RB management/NN beat/NN and/CC launch/NN ./. <EOS>/<EOS>	LOC#0 LOC#1 LOC#2 := LOC#5 LOC#6 LOC#7 LOC#8 ^ E LOC#10 . ( LOC#12 LOC#13 ) ^ E LOC#10 . ( LOC#15 ) <EOS>
all/DT the/DT harmonious/JJ boiling/JJ weekend/NN are/VBP also/RB scholar/NN rumor/NN of/IN wall/NN that/WDT in/VB survivor/NN of/IN fall/NN or/CC of/IN capability/NN ./. <EOS>/<EOS>	LOC#2 LOC#3 LOC#4 := LOC#7 LOC#8 LOC#9 LOC#10 ^ E LOC#12 . ( LOC#13 LOC#14 LOC#15 U LOC#13 LOC#17 LOC#18 ) <EOS>
all/DT lawyer/NN orientation/NN of/IN debt/NN gather/VB at/IN most/JJS NUM/CD but/CC not/RB less/JJR than/IN NUM/CD notion/NN ./. <EOS>/<EOS>	LOC#1 LOC#2 LOC#3 LOC#4 := ( <= LOC#8 && >= LOC#13 ) LOC#5 . ( LOC#14 ) <EOS>
sweltering/JJ negotiation/NN of/IN harm/NN are/VBP second-hand/JJ human/JJ confession/NN and/CC egg/NN of/IN either/JJ weapon/NN ./. <EOS>/<EOS>	LOC#0 LOC#1 LOC#2 LOC#3 := LOC#5 LOC#6 LOC#7 ^ LOC#9 LOC#10 LOC#11 LOC#12 <EOS>
olive/NN <UNK>/NN of/IN puppy/NN are/VBP also/RB clay/NN of/IN <UNK>/NN slavery/NN or/CC misty/JJ material/NN book/NN ./. <EOS>/<EOS>	LOC#0 LOC#1 LOC#2 LOC#3 := LOC#6 LOC#7 LOC#8 LOC#9 U LOC#11 LOC#12 LOC#13 <EOS>
all/DT picture/NN of/IN <UNK>/NN are/VBP also/RB matrix/NN of/IN integer/NN sample/NN and/CC everything/NN ./. <EOS>/<EOS>	LOC#1 LOC#2 LOC#3 := LOC#6 LOC#7 LOC#8 LOC#9 ^ LOC#11 <EOS>
a/DT fish/NN dealer/NN of/IN compliance/NN is/VBZ also/RB a/DT loyal/JJ people/NN similarity/NN or/CC a/DT continent/NN camera/NN of/IN edition/NN ./. <EOS>/<EOS>	LOC#1 LOC#2 LOC#3 LOC#4 := LOC#8 LOC#9 LOC#10 U LOC#13 LOC#14 LOC#15 LOC#16 <EOS>
every/DT filthy/JJ offering/NN scope/NN is/VBZ a/DT makeshift/JJ break/NN of/IN shark/NN or/CC a/DT confusion/NN of/IN alternative/NN ./. <EOS>/<EOS>	LOC#1 LOC#2 LOC#3 := LOC#6 LOC#7 LOC#8 LOC#9 U LOC#12 LOC#13 LOC#14 <EOS>
knowledgeable/JJ tendency/NN poem/NN axis/VB only/RB starter/NN of/IN pulse/NN or/CC of/IN associated/JJ iodine/NN ./. <EOS>/<EOS>	LOC#0 LOC#1 LOC#2 := A LOC#3 . ( LOC#5 LOC#6 LOC#7 U LOC#5 LOC#9 LOC#10 LOC#11 ) <EOS>
circumstance/NN of/IN dancing/NN are/VBP repulsive/JJ inspection/NN of/IN forehead/NN that/WDT are/VBP engineering/NN of/IN one-dimensional/JJ agreement/NN ./. <EOS>/<EOS>	LOC#0 LOC#1 LOC#2 := LOC#4 LOC#5 LOC#6 LOC#7 ^ LOC#10 LOC#11 LOC#12 LOC#13 <EOS>
a/DT bid/NN is/VBZ also/RB a/DT wide-eyed/JJ <UNK>/NN of/IN bottle/NN that/WDT is/VBZ fierce/JJ integration/NN ./. <EOS>/<EOS>	LOC#1 := LOC#5 LOC#6 LOC#7 LOC#8 ^ LOC#11 LOC#12 <EOS>
all/DT the/DT park/NN see/VB experience/NN of/IN equal/JJ swing/NN or/CC of/IN fuel/NN ./. <EOS>/<EOS>	LOC#2 := E LOC#3 . ( LOC#4 LOC#5 LOC#6 LOC#7 U LOC#4 LOC#9 LOC#10 ) <EOS>
a/DT sternum/NN <UNK>/NN of/IN reminder/NN come/VB or/CC <UNK>/VB also/RB negative/JJ defense/NN pile/NN and/CC overt/JJ <UNK>/NN elevator/NN ./. <EOS>/<EOS>	LOC#1 LOC#2 LOC#3 LOC#4 := E ( LOC#5 U LOC#7 ) . ( LOC#9 LOC#10 LOC#11 ) ^ E ( LOC#5 U LOC#7 ) . ( LOC#13 LOC#14 LOC#15 ) <EOS>
intent/NN of/IN calculation/NN juggle/VB and/CC squeak/VB also/RB demographic/JJ or/CC important/JJ corridor/NN ./. <EOS>/<EOS>	LOC#0 LOC#1 LOC#2 := E ( LOC#3 ^ LOC#5 ) . ( LOC#7 LOC#10 U LOC#9 LOC#10 ) <EOS>
every/DT smell/NN rub/VB and/CC hesitate/VB also/RB guiltless/JJ or/CC collective/JJ student/NN ./. <EOS>/<EOS>	LOC#1 := E ( LOC#2 ^ LOC#4 ) . ( LOC#6 LOC#9 U LOC#8 LOC#9 ) <EOS>
every/DT lamp/NN of/IN spiritual/JJ difficulty/NN is/VBZ a/DT English/NN and/CC a/DT <UNK>/NN of/IN normal/JJ beauty/NN ./. <EOS>/<EOS>	LOC#1 LOC#2 LOC#3 LOC#4 := LOC#7 ^ LOC#10 LOC#11 LOC#12 LOC#13 <EOS>
a/DT autonomy/NN technician/NN is/VBZ a/DT composition/NN of/IN utter/JJ vitamin/NN that/WDT is/VBZ berkelium/NN of/IN broker/NN Palestinian/NN ./. <EOS>/<EOS>	LOC#1 LOC#2 := LOC#5 LOC#6 LOC#7 LOC#8 ^ LOC#11 LOC#12 LOC#13 LOC#14 <EOS>
dimension/NN isle/NN acknowledge/VB only/RB dust/NN of/IN genuine/JJ sight/NN and/CC of/IN integumentary/JJ CEO/NN ./. <EOS>/<EOS>	LOC#0 LOC#1 := A LOC#2 . ( LOC#4 LOC#5 LOC#6 LOC#7 ^ LOC#4 LOC#9 LOC#10 LOC#11 ) <EOS>
a/DT teammate/NN of/IN classifier/NN integrity/NN is/VBZ a/DT precementoblast/NN of/IN <UNK>/NN that/WDT is/VBZ precious/JJ ./. <EOS>/<EOS>	LOC#1 LOC#2 LOC#3 LOC#4 := LOC#7 LOC#8 LOC#9 ^ LOC#12 <EOS>
every/DT progressive/JJ sandwich/NN of/IN dialog/NN is/VBZ also/RB a/DT meter/NN of/IN <UNK>/JJ care/NN that/WDT create/VB also/RB <UNK>/NN killing/NN and/CC economist/NN <UNK>/NN ./. <EOS>/<EOS>	LOC#1 LOC#2 LOC#3 LOC#4 := LOC#8 LOC#9 LOC#10 LOC#11 ^ E LOC#13 . ( LOC#15 LOC#16 ) ^ E LOC#13 . ( LOC#18 LOC#19 ) <EOS>
all/DT intervention/NN bankruptcy/NN are/VBP rockfalls/NN <UNK>/NN that/WDT <UNK>/VB and/CC swim/VB puzzle/NN of/IN ability/NN and/CC of/IN towering/JJ <UNK>/NN ./. <EOS>/<EOS>	LOC#1 LOC#2 := LOC#4 LOC#5 ^ E ( LOC#7 ^ LOC#9 ) . ( LOC#10 LOC#11 LOC#12 ^ LOC#10 LOC#14 LOC#15 LOC#16 ) <EOS>
drawing/NN court/NN of/IN sun/NN are/VBP extension/NN of/IN <UNK>/NN and/CC abounding/JJ endochondral/JJ mirror/NN ./. <EOS>/<EOS>	LOC#0 LOC#1 LOC#2 LOC#3 := LOC#5 LOC#6 LOC#7 ^ LOC#9 LOC#10 LOC#11 <EOS>
all/DT the/DT childhood/NN bird/NN of/IN swimming/NN are/VBP step/NN of/IN topping/NN dorsal/NN that/WDT rectify/VB technological/JJ watch/NN of/IN foot/NN and/CC of/IN cry/NN ./. <EOS>/<EOS>	LOC#2 LOC#3 LOC#4 LOC#5 := LOC#7 LOC#8 LOC#9 LOC#10 ^ E LOC#12 . ( LOC#13 LOC#14 LOC#15 LOC#16 ^ LOC#13 LOC#14 LOC#18 LOC#19 ) <EOS>
belief/NN of/IN skilled/JJ defeat/NN whine/VB and/CC <UNK>/VB also/RB cynical/JJ governor/NN ,/. defensive/JJ conception/NN <UNK>/NN ,/. or/CC custom/NN consciousness/NN ./. <EOS>/<EOS>	LOC#0 LOC#1 LOC#2 LOC#3 := E ( LOC#4 ^ LOC#6 ) . ( LOC#8 LOC#9 U LOC#11 LOC#12 LOC#13 U LOC#16 LOC#17 ) <EOS>
all/DT the/DT profile/NN of/IN working/JJ bonus/NN ought/VB and/CC enact/VB also/RB rhenium/NN and/CC uncertain/JJ pack/NN ./. <EOS>/<EOS>	LOC#2 LOC#3 LOC#4 LOC#5 := E ( LOC#6 ^ LOC#8 ) . ( LOC#10 ) ^ E ( LOC#6 ^ LOC#8 ) . ( LOC#12 LOC#13 ) <EOS>
impartial/JJ lesson/NN of/IN musician/NN are/VBP also/RB tragedy/NN of/IN needless/JJ <UNK>/NN or/CC myth/NN of/IN money/NN ./. <EOS>/<EOS>	LOC#0 LOC#1 LOC#2 LOC#3 := LOC#6 LOC#7 LOC#8 LOC#9 U LOC#11 LOC#12 LOC#13 <EOS>
exoskeleton/NN of/IN direct/JJ helium/NN retain/VB not/RB less/JJR than/IN NUM/CD but/CC less/JJR than/IN NUM/CD risky/JJ corporation/NN ./. <EOS>/<EOS>	LOC#0 LOC#1 LOC#2 LOC#3 := ( >= LOC#8 && < LOC#12 ) LOC#4 . ( LOC#13 LOC#14 ) <EOS>
touchdown/NN officer/NN are/VBP also/RB hypnotic/JJ mistake/NN that/WDT are/VBP stop/NN of/IN expert/NN sympathy/NN ./. <EOS>/<EOS>	LOC#0 LOC#1 := LOC#4 LOC#5 ^ LOC#8 LOC#9 LOC#10 LOC#11 <EOS>
a/DT landscape/NN of/IN cattle/NN adviser/NN is/VBZ something/NN that/WDT amuse/VB or/CC anticipate/VB also/RB inconclusive/JJ stranger/NN ,/. <UNK>/NN ,/. and/CC local/JJ display/NN <UNK>/NN ./. <EOS>/<EOS>	LOC#1 LOC#2 LOC#3 LOC#4 := E ( LOC#8 U LOC#10 ) . ( LOC#12 LOC#13 ) ^ E ( LOC#8 U LOC#10 ) . ( LOC#15 ) ^ E ( LOC#8 U LOC#10 ) . ( LOC#18 LOC#19 LOC#20 ) <EOS>
every/DT <UNK>/JJ illness/NN of/IN style/NN do/VBP not/RB frown/VB roomy/JJ ,/. slimy/JJ and/CC osteoid/JJ dignity/NN ./. <EOS>/<EOS>	LOC#1 LOC#2 LOC#3 LOC#4 := ! E LOC#7 . ( LOC#8 LOC#13 ^ LOC#10 LOC#13 ^ LOC#12 LOC#13 ) <EOS>
nutty/JJ driver/NN maintenance/NN are/VBP look/NN of/IN glance/NN or/CC long-term/JJ indigenous/JJ <UNK>/NN ./. <EOS>/<EOS>	LOC#0 LOC#1 LOC#2 := LOC#4 LOC#5 LOC#6 U LOC#8 LOC#9 LOC#10 <EOS>
call/NN are/VBP everything/NN that/WDT methodize/VB or/CC discriminate/VB no/DT <UNK>/JJ ,/. mellow/JJ or/CC distalmost/JJ tetraploid/NN ./. <EOS>/<EOS>	LOC#0 := ! E ( LOC#4 ^ LOC#6 ) . ( LOC#8 LOC#13 U LOC#10 LOC#13 U LOC#12 LOC#13 ) <EOS>
a/DT idiotic/JJ distribution/NN of/IN switch/NN is/VBZ also/RB a/DT democracy/NN of/IN psychotic/JJ Congress/NN or/CC a/DT balloon/NN of/IN easy/JJ prevention/NN ./. <EOS>/<EOS>	LOC#1 LOC#2 LOC#3 LOC#4 := LOC#8 LOC#9 LOC#10 LOC#11 U LOC#14 LOC#15 LOC#16 LOC#17 <EOS>
well-known/JJ gigantic/JJ salad/NN choose/VB only/RB upper/JJ song/NN and/CC <UNK>/NN ./. <EOS>/<EOS>	LOC#0 LOC#1 LOC#2 := A LOC#3 . ( LOC#5 LOC#6 ) ^ A LOC#3 . ( LOC#8 ) <EOS>
streak/NN of/IN puzzling/JJ specification/NN <UNK>/VB and/CC evolve/VB only/RB thoot/NN dark/NN and/CC genetic/JJ curtain/NN ./. <EOS>/<EOS>	LOC#0 LOC#1 LOC#2 LOC#3 := A ( LOC#4 ^ LOC#6 ) . ( LOC#8 LOC#9 ) ^ A ( LOC#4 ^ LOC#6 ) . ( LOC#11 LOC#12 ) <EOS>
collapse/NN of/IN <UNK>/NN fork/NN are/VBP also/RB holistic/JJ lawmaker/NN of/IN goal/NN or/CC utopian/JJ crest/NN ./. <EOS>/<EOS>	LOC#0 LOC#1 LOC#2 LOC#3 := LOC#6 LOC#7 LOC#8 LOC#9 U LOC#11 LOC#12 <EOS>
every/DT <UNK>/NN is/VBZ a/DT division/NN or/CC a/DT sheet/NN of/IN wandering/JJ voter/NN ./. <EOS>/<EOS>	LOC#1 := LOC#4 U LOC#7 LOC#8 LOC#9 LOC#10 <EOS>
<UNK>/NN grief/NN are/VBP also/RB graceful/JJ platform/NN glimpse/NN that/WDT are/VBP critic/NN bucket/NN of/IN sofa/NN ./. <EOS>/<EOS>	LOC#0 LOC#1 := LOC#4 LOC#5 LOC#6 ^ LOC#9 LOC#10 LOC#11 LOC#12 <EOS>
<UNK>/NN are/VBP fitness/NN of/IN <UNK>/NN arena/NN and/CC mental/JJ client/NN of/IN transportation/NN ./. <EOS>/<EOS>	LOC#0 := LOC#2 LOC#3 LOC#4 LOC#5 ^ LOC#7 LOC#8 LOC#9 LOC#10 <EOS>
a/DT eager/JJ ministry/NN agent/NN is/VBZ also/RB a/DT gesture/NN <UNK>/NN of/IN ununpentium/NN and/CC a/DT trouble/NN of/IN direful/JJ planet/NN ./. <EOS>/<EOS>	LOC#1 LOC#2 LOC#3 := LOC#7 LOC#8 LOC#9 LOC#10 ^ LOC#13 LOC#14 LOC#15 LOC#16 <EOS>
all/DT the/DT rock/NN of/IN outdoor/JJ pause/NN are/VBP also/RB strip/NN or/CC <UNK>/NN of/IN bunch/NN ./. <EOS>/<EOS>	LOC#2 LOC#3 LOC#4 LOC#5 := LOC#8 U LOC#10 LOC#11 LOC#12 <EOS>
all/DT ripe/JJ volunteer/NN of/IN recognition/NN orient/VB and/CC admire/VB also/RB personal/JJ framework/NN of/IN cabin/NN and/CC of/IN performance/NN ./. <EOS>/<EOS>	LOC#1 LOC#2 LOC#3 LOC#4 := E ( LOC#5 ^ LOC#7 ) . ( LOC#9 LOC#10 LOC#11 LOC#12 ^ LOC#9 LOC#10 LOC#14 LOC#15 ) <EOS>
article/NN master/NN are/VBP also/RB <UNK>/NN of/IN departure/NN that/WDT are/VBP voluntary/JJ ./. <EOS>/<EOS>	LOC#0 LOC#1 := LOC#4 LOC#5 LOC#6 ^ LOC#9 <EOS>
a/DT elfin/JJ comparable/JJ hive/NN is/VBZ also/RB something/NN that/WDT echo/VB more/JJR than/IN NUM/CD rude/JJ or/CC common/JJ finding/NN ./. <EOS>/<EOS>	LOC#1 LOC#2 LOC#3 := > LOC#11 LOC#8 . ( LOC#12 LOC#15 U LOC#14 LOC#15 ) <EOS>
